1,1,898445,SKI - DC1,Jl. Rawa Gelam IV No. 6,JAKARTA TIMUR,13930,SKI-Z4,SKI Z4,300
2,1,900689,SKI-PT. AKUR PRATAMA_YOGYA GROUP,"JL. RE.MARTADINATA NO.3 SMI, S",SUKABUMI,43111,SKI-Z1CP01,SUKABUMI KOTA,200
3,1,900693,SKI-PT. AKUR PRATAMA (CJR)_YOGYA,"JL. RE.MARTADINATA NO.3 SMI, S",SUKABUMI,43111,SKI-Z3CP01,"WARUNG KIARA,CITARIK,",203
4,1,900697,SKI-TK. BINTANG TIMUR,PS. BJ. MERON NO.44 BJ.MERON,CIANJUR,43214,SKI-Z3CP01,"WARUNG KIARA,CITARIK,",203
5,1,900702,SKI-TK. KERSAMANAH II,"PS. CIRANJANG NO. 24 A CRJ , C",CIANJUR,43282,SKI-RXLK01,EXP LUAR KOTA CIANJUR,301
6,1,900703,SKI-TK. SRI,"JL. LENGKONG RT.04/01 JAMPANG,",SUKABUMI,43174,SKI-Z3CP02,"CIANJUR SELATAN, SAGAR",204
7,1,900704,SKI-TK. SEGAR,JL.TIPAR GEDE RUKO 1 NO. 21,SUKABUMI,43141,SKI-Z1CP01,SUKABUMI KOTA,200
8,1,900705,SKI-TK. HASIL,"JL.TANGGEUNG WR.TILU CIANJUR,",CIANJUR,43267,SKI-Z3CP02,"CIANJUR SELATAN, SAGAR",210
9,1,900706,SKI-TK. DOA IBU,PS. PARUNG KUDA BLK H NO.6 SMI,KAB. SUKABUMI,43357,SKI-Z3CP01,"WARUNG KIARA,CITARIK,",202
10,1,900708,SKI-TK. JATI ASIH,PS. INDUK PASIR HAYAM BLOK C N,CIANJUR,43214,SKI-Z3CP01,"WARUNG KIARA,CITARIK,",203
11,1,900709,SKI-TK. AGYARI,JL.TANGGEUNG WANGUN NO.3 CJR,CIANJUR,43267,SKI-Z3CP02,"CIANJUR SELATAN, SAGAR",203
12,1,900710,SKI-TK. JMFARMA,JL. TANGGEUNG NO.7 CIANJUR,CIANJUR,43267,SKI-Z3CP02,"CIANJUR SELATAN, SAGAR",210
13,1,900711,SKI-DINAS KESEHATAN KOTA SUKABUM,JL. SURYAKENCANA NO.45 RT.01/0,SUKABUMI,43114,SKI-Z1PH01,SUKABUMI KOTA,100
14,1,900712,SKI-TK. MILIK,PS. RAHAYU CIPANAS BLOK A NO.,CIANJUR,43253,SKI-Z3CP01,"WARUNG KIARA,CITARIK,",203
15,1,900713,SKI-TK. AJIB,PS PARUNG KUDA BLOK DEPAN 19 B,KAB. SUKABUMI,43357,SKI-Z3CP01,"WARUNG KIARA,CITARIK,",202
16,1,900714,SKI-TK. DOA IBU,"PS. RAHAYU RH NO. 5 CIPANAS, C",CIANJUR,43253,SKI-Z3CP01,"WARUNG KIARA,CITARIK,",203
17,1,900715,SKI-AP. KIMIA FARMA 8,"JL. VETERAN II/2 SUKABUMI, SUK",SUKABUMI,43121,SKI-Z1PH01,SUKABUMI KOTA,100
18,1,900716,SKI-TK. SERASI,"PS. INDUK NO. 7 CIANJUR, CIANJ",CIANJUR,43211,SKI-Z3CP01,"WARUNG KIARA,CITARIK,",206
19,1,900724,SKI-TK. ERIA JAYA,"JL. CINIFI RT.09/01 SURADE, SU",SUKABUMI,43179,SKI-Z3CP02,"CIANJUR SELATAN, SAGAR",210
20,1,900725,SKI-TK. SOPYAN,"PS. CIBEBER, SUKABUMI",CIANJUR,43262,SKI-Z3CP01,"WARUNG KIARA,CITARIK,",203
21,1,900726,SKI-AP. KIMIA FARMA 221,JL. JEND. SUDIRMAN NO. 9 GUNUN,SUKABUMI,43123,,,100
22,1,900727,SKI-TK. REVAN PUTRA,"JL. CIPANDAK KM.7 CIDAUN, CIAN",CIANJUR,43275,SKI-Z3CP02,"CIANJUR SELATAN, SAGAR",203
23,1,900728,SKI-MM. CIREMAI GROSIR,JL.HALTE MALEBER RUKO KAV.A NO,CIANJUR,43281,SKI-Z3CP01,"WARUNG KIARA,CITARIK,",203
24,1,900729,SKI-TK. DADANG,"PS. RAHAYU 57 CIPANAS, CIANJUR",CIANJUR,43253,SKI-Z3CP01,"WARUNG KIARA,CITARIK,",206
25,1,900730,SKI-TK. SITANGGANG,"PS. GSP PACET CIPANAS, CIANJUR",CIANJUR,43253,SKI-Z3CP01,"WARUNG KIARA,CITARIK,",206
26,1,900731,BGR-TK. KARTIKA,"JL. PAGELARAN NO.16 CIANJUR, J",CIANJUR,43266,SKI-Z3CP02,"CIANJUR SELATAN, SAGAR",210
27,1,900732,SKI-AP. KIMIA FARMA CICURUG,JL. SILIWANGI NO. 416 CICURUG,SUKABUMI,43359,SKI-Z2PH01,"PALABUHAN RATU, SURADE",102
28,1,900733,SKI-TK. SUMBER RIZKI II,"JL. SILIWANGI NO.203 CICURUG,",SUKABUMI,43364,SKI-Z2CP01,"CIKEMBAR,CIKEMBANG,CIB",202
29,1,900734,SKI-TK. AA,JL. LENGKONG RT.28/5 CIREPAN,SUKABUMI,43174,SKI-Z3CP02,"CIANJUR SELATAN, SAGAR",203
30,1,900735,SKI-AP. KIMIA FARMA 365,JL. IR. H. JUANDA NO. 37 PAMOY,CIANJUR,43211,SKI-Z3PH01,"CIANJUR KOTA, CIBEBER,",104
31,1,900736,SKI-TK. SANGHAI II,"PS. MUKA 121 RUKO CIANJUR, CIA",CIANJUR,43215,SKI-Z3CP01,"WARUNG KIARA,CITARIK,",203
32,1,900737,SKI-TK. MAMAN,PS PARUNG KUDA BLOK G NO.60 SU,KAB. SUKABUMI,43357,SKI-Z3CP01,"WARUNG KIARA,CITARIK,",202
33,1,900738,SKI-TK. SISDIANA,"JL. CIEMAS RT.07/01 CIEMAS, SU",SUKABUMI,43177,SKI-Z3CP02,"CIANJUR SELATAN, SAGAR",210
34,1,900739,SKI-TK. KAPAL API,"PS. CIRANJANG NO. 39 CRJ, CIAN",CIANJUR,43282,SKI-Z3CP01,"WARUNG KIARA,CITARIK,",203
35,1,900740,"SKI-TK. ANA,HJ","JL. PAGELARAN NO.15 CIANJUR, C",CIANJUR,43266,SKI-Z3CP02,"CIANJUR SELATAN, SAGAR",210
36,1,900741,SKI-TK. ASEP,"JL. CIEMAS RT.05/01 JP KULON,",SUKABUMI,43177,SKI-Z3CP02,"CIANJUR SELATAN, SAGAR",210
37,1,900742,SKI-TK. ASRI,JL. BHAYANG KARA 49 SMI,SUKABUMI,43123,SKI-Z1CP01,SUKABUMI KOTA,200
38,1,900743,SKI-AP. CIPANAS,JL.RAYA CIPANAS NO.144 CIANJUR,CIANJUR,43253,SKI-Z3PH01,"CIANJUR KOTA, CIBEBER,",102
39,1,900744,SKI-MM. HAPPY,JL. HANJAWAR PACET NO.61 CIANJ,CIANJUR,43253,SKI-Z3CP01,"WARUNG KIARA,CITARIK,",203
40,1,900745,SKI-TK. LILIS,"JL. NEGLASARI RT.01/02 JPKLN,",KAB. SUKABUMI,43178,SKI-Z3CP02,"CIANJUR SELATAN, SAGAR",203
41,1,900746,SKI-TK. RELASI,"KP. CILETUK KIARA II RT 32/08,",KAB. SUKABUMI,43151,SKI-Z3CP02,"CIANJUR SELATAN, SAGAR",203
42,1,900747,SKI-TK. ACONG,JL. RE MARTADINATA NO.20 - SMI,SUKABUMI,43111,SKI-Z1CP01,SUKABUMI KOTA,200
43,1,900748,SKI-TK. PADMA,JL. LENGKONG RT.09/03 SUKABUMI,SUKABUMI,43174,SKI-Z3CP02,"CIANJUR SELATAN, SAGAR",203
44,1,900749,SKI-TK. AL HIKMAH,"PS. PARUNG KUDA BLK F2 SMI, SU",SUKABUMI,43357,SKI-Z3CP01,"WARUNG KIARA,CITARIK,",202
45,1,900750,SKI-PT. PANJUNAN,JL. RAYA BANDUNG KM. 5 DEPAN R,CIANJUR,43291,SKI-Z3CP01,"WARUNG KIARA,CITARIK,",202
46,1,900751,SKI-TK. HENDI,"JL. RAYA CIKASO KM.1 SURADE, S",KAB. SUKABUMI,43179,SKI-Z3CP02,"CIANJUR SELATAN, SAGAR",203
47,1,900752,SKI-TK. WIRYO,JL. BARU NO.2 PEL. RATU SMI,KAB. SUKABUMI,43364,SKI-Z2CP01,"CIKEMBAR,CIKEMBANG,CIB",201
48,1,900753,SKI-TO. PELITA,JL. STASION BARAT NO.15 BLOK A,SUKABUMI,43111,SKI-Z1CP01,SUKABUMI KOTA,200
49,1,900754,SKI-TK. SAEFUL,PS.CIBADAK LOS.C NO.7 CIBADAK,SUKABUMI,43351,SKI-Z3CP01,"WARUNG KIARA,CITARIK,",202
50,1,900755,SKI-PT. PANJUNAN,"JL. RA. KOSASIH NO.9 SUKARAJA,",KAB. SUKABUMI,43192,SKI-Z2CP02,"PARUNG KUDA, PARAKAN S",201
51,1,900756,SKI-TK. YOGA,"JL. TAMAN JAYA CIEMAS SURADE,",SUKABUMI,43179,SKI-Z3CP02,"CIANJUR SELATAN, SAGAR",210
52,1,900757,SKI-TK. RATNA,JL. A. YANI NO. 229 SUKABUMI,SUKABUMI,43112,SKI-Z1CP01,SUKABUMI KOTA,200
53,1,900758,SKI-TK. KITA,JL. CIWANGI NO. 10 SUKABUMI,SUKABUMI,43111,SKI-Z1CP01,SUKABUMI KOTA,200
54,1,900759,SK-TK. KURNIA,"KP. WALURAN DS. WALURAN SMI, S",SUKABUMI,43175,SKI-Z3CP02,"CIANJUR SELATAN, SAGAR",210
55,1,900760,SKI-TK. WINI PUTRI,JL. TAMAN JAYA RT.02/03 CIEMAS,SUKABUMI,43177,SKI-Z3CP02,"CIANJUR SELATAN, SAGAR",210
56,1,900761,SKI-AP. SUMBER WARAS,JL. HARUM KABIR NO.1 SUKABUMI,SUKABUMI,43111,SKI-Z1PH01,SUKABUMI KOTA,100
57,1,900762,SKI-TK. ANNA,"TERMINAL CIBADAK BLK C NO 11,",SUKABUMI,43351,SKI-Z2CP01,"CIKEMBAR,CIKEMBANG,CIB",202
58,1,900763,SKI-TK. SINAR JAYA,"JL. KIDUNG KENCANA P.RATU SMI,",SUKABUMI,43364,SKI-Z3CP01,"WARUNG KIARA,CITARIK,",205
59,1,900764,SKI-MM. TANJUNG,JL. SUKANEGARA 01/01 NO.20,CIANJUR,43212,SKI-Z3CP02,"CIANJUR SELATAN, SAGAR",203
60,1,900765,SKI-TK. AL-ZENA,PS. CICURUG BLK D NO 3 CIBADAK,SUKABUMI,43359,SKI-Z3CP01,"WARUNG KIARA,CITARIK,",202
61,1,900766,SKI-TK. RIDO,JL. A YANI NO. 217 SUKABUMI,SUKABUMI,43112,SKI-Z1CP01,SUKABUMI KOTA,200
62,1,900767,SKI-AP. RB. RIDO GALIH,"JL. GUDANG NO. 24 SUKABUMI, SU",SUKABUMI,43151,SKI-Z1PH01,SUKABUMI KOTA,100
63,1,900768,SKI-TK. SUGIH,JL. SUKANEGARA RT.01/01 NO.45,CIANJUR,43264,SKI-Z3CP02,"CIANJUR SELATAN, SAGAR",203
64,1,900769,SKI-TK. ANUGRAH AGUNG,JL.ARIEF RAHMAN HAKIM SUKABUMI,SUKABUMI,43132,SKI-Z1CP01,SUKABUMI KOTA,200
65,1,900770,SKI-TK. OKEKE,JL. RY CIPANAS NO.8 CIANJUR,CIANJUR,43253,SKI-Z3CP01,"WARUNG KIARA,CITARIK,",203
66,1,900771,SK-TK. UJU,"JL. RY.CIPEUYEUM NO. 602, CIAN",CIANJUR,43282,SKI-Z3CP01,"WARUNG KIARA,CITARIK,",203
67,1,900772,SKI-TK. ARUM SARI,JL. CIKEMBAR KM.18 SUKABUMI,SUKABUMI,43157,SKI-Z2CP01,"CIKEMBAR,CIKEMBANG,CIB",202
68,1,900773,SKI-TK. ANDI,"TERMINAL CIBADAK SUKABUMI, SUK",KAB. SUKABUMI,43351,SKI-Z3CP01,"WARUNG KIARA,CITARIK,",202
69,1,900774,SKI-TO. SUMBER WANGI,JL. JEND. A. YANI NO.7B BLKNG,SUKABUMI,43111,SKI-Z1CP01,SUKABUMI KOTA,200
70,1,900775,SKI-TK. LAKSANA,JL. RY CIKEMBANG NO.7 SUKABUMI,SUKABUMI,43111,SKI-Z2CP01,"CIKEMBAR,CIKEMBANG,CIB",202
71,1,900776,SKI-TK. SUMBER REJEKI,PS. TERMINAL CIPANAS,CIANJUR,43253,SKI-Z3CP01,"WARUNG KIARA,CITARIK,",203
72,1,900777,PT. HERO SUPERMARKET GUARDIAN,"JL. RE. MARTADINATA NO.25, SUK",SUKABUMI,43111,SKI-Z1CP01,SUKABUMI KOTA,200
73,1,900778,SKI-TK. DAMAI               *,PS. CIBADAK BLOK AB V NO. 8-10,KAB. SUKABUMI,43351,SKI-Z3CP01,"WARUNG KIARA,CITARIK,",202
74,1,900779,SKI-TK. MEGAH JAYA,PS. CICURUG JL. SILIWANGI NO.3,KAB. SUKABUMI,43359,SKI-Z3CP01,"WARUNG KIARA,CITARIK,",202
75,1,900780,SKI-TO. ANISA,JL. SUKANEGARA 01/01 NO.29,CIANJUR,43264,SKI-Z3CP02,"CIANJUR SELATAN, SAGAR",203
76,1,900781,SKI-TK. SINAR ANUGRAH,JL. TEGAL BULED 41,KAB. SUKABUMI,43186,SKI-Z3CP02,"CIANJUR SELATAN, SAGAR",203
77,1,900782,SKI-TK. IMANUEL,"TERMINAL CIBADAK BLOK D NO 5,",KAB. SUKABUMI,43351,SKI-Z3CP01,"WARUNG KIARA,CITARIK,",202
78,1,900783,SKI-TK. ABDUL WAHID,"PS. GSP BLK E/3A CIPANAS, CIAN",CIANJUR,43253,SKI-Z3CP01,"WARUNG KIARA,CITARIK,",206
79,1,900784,SKI-TK. SARI BUMI,JL. TEGAL BULED NO.15,SUKABUMI,43186,SKI-Z3CP02,"CIANJUR SELATAN, SAGAR",210
80,1,900785,SKI-TK. DEDI AR,PS.CIBADAK BLOK AB V NO 20 SMI,KAB. SUKABUMI,43351,SKI-Z3CP01,"WARUNG KIARA,CITARIK,",202
81,1,900786,SKI-PT. HERO SUPERMARKET,JL. RE. MARTADINATA NO.25 SUKA,SUKABUMI,43111,SKI-Z1CP01,SUKABUMI KOTA,200
82,1,900787,SKI-TK. BAROKAH,KOMP. PERTOKOAN GELANGGANG NO.,CIANJUR,43282,SKI-Z3CP01,"WARUNG KIARA,CITARIK,",203
83,1,900788,SKI-TK. MARISSA,PERUM BAROS KENCANA JL. JAMRUD,SUKABUMI,43161,SKI-Z1CP01,SUKABUMI KOTA,200
84,1,900789,SKI-TK. CIBADAK JAYA,JL. SILIWANGI NO. 36 CICURUG,SUKABUMI,43359,SKI-Z2CP01,"CIKEMBAR,CIKEMBANG,CIB",202
85,1,900790,SKI-TC. PURNAMA,PERTOKOAN LABORA BLOK C 1-2-3,SUKABUMI,43351,SKI-Z2CP01,"CIKEMBAR,CIKEMBANG,CIB",202
86,1,900791,SKI-TC MITRA,PS. CIBADAK BLOK A1 NO. 10 CIB,SUKABUMI,43351,SKI-Z3CP01,"WARUNG KIARA,CITARIK,",202
87,1,900792,SKI-TC. PADASUKA,JL. STASIUN BARAT NO.30 GUNUNG,SUKABUMI,43111,SKI-Z1CP01,SUKABUMI KOTA,200
88,1,900793,SKI-TK. MILIK,PS. RAHAYU CIPANAS BLOK A NO.,CIANJUR,43253,SKI-RXLK01,EXP LUAR KOTA CIANJUR,301
89,1,900794,SKI-AP. MITRA FARMA (RS. CJR),"JL. RUMAH SAKIT NO. 1 CIANJUR,",CIANJUR,43211,SKI-Z3PH01,"CIANJUR KOTA, CIBEBER,",104
90,1,900795,SKI-TK. MARISSA_GROUP_NA,PERUM BAROS KENCANA JL. JAMRUD,SUKABUMI,43161,SKI-RXPD01,EXP DALAM KOTA SUKABUM,302
91,1,900796,SKI-TK. HERMAN,"JL. SILIWANGI NO.203 CICURUG,",SUKABUMI,43364,SKI-RXLK02,EXP LUAR KOTA SUKABUMI,302
92,1,900797,SKI-TK. SAMSOE,TERMINAL CIBADAK BLOK C NO.16,SUKABUMI,43351,SKI-Z3CP01,"WARUNG KIARA,CITARIK,",202
93,1,900798,SKI-TK. SILIH ASIH,"JL. SILIWANGI NO.203 CICURUG,",SUKABUMI,43364,SKI-Z2CP01,"CIKEMBAR,CIKEMBANG,CIB",202
94,1,900799,SKI-GUARDIAN GIANT SPM KOSASIH,"JL. RA KOSASIH CIBEUREUM, SUKA",SUKABUMI,43165,SKI-Z1CP01,SUKABUMI KOTA,200
95,1,900800,SKI-TK. POPULER,PS. PANGLESERAN BLOK E NO. 3 C,SUKABUMI,43168,SKI-Z1CP01,SUKABUMI KOTA,200
96,1,900801,SKI-TK. DOA IBU LAMA,"JL. CISAAT 4/3 CITARIK, SUKABU",SUKABUMI,43152,SKI-RXPD01,EXP DALAM KOTA SUKABUM,302
97,1,900802,SKI-TK. DAMEY,JL. GUDANG SAGARANTEN 23,SUKABUMI,43181,SKI-Z3CP02,"CIANJUR SELATAN, SAGAR",210
98,1,900803,SKI-TK. SUMBER PASIR,JL. KARANG ANYAR 28 TEGAL BULE,SUKABUMI,43186,SKI-Z3CP02,"CIANJUR SELATAN, SAGAR",210
99,1,900804,SKI-TK. HENI,JL. KARANG ANYAR 14 TEGAL BULE,SUKABUMI,43186,SKI-Z3CP02,"CIANJUR SELATAN, SAGAR",210
100,1,900819,SKI-TK. GUNAJAYA,"JL. BAROS SAGARANTEN NO.13, SU",SUKABUMI,43161,SKI-Z3CP02,"CIANJUR SELATAN, SAGAR",203
101,1,900824,SKI-TK. PURNAMA JAYA,JL. CIRACAP PS BARAGA RT.49/07,SUKABUMI,43176,SKI-Z3CP02,"CIANJUR SELATAN, SAGAR",203
102,1,900832,SKI-TK. POJOK JAYA,"JL. GUDANG SAGARANTEN RT.5/5,",SUKABUMI,43181,SKI-Z3CP02,"CIANJUR SELATAN, SAGAR",210
103,1,900836,SKI-MM. SALAM LESTARI,JL. KH ABDULLAH RANCAGOONG CIA,CIANJUR,43285,SKI-Z3CP01,"WARUNG KIARA,CITARIK,",203
104,1,900839,SKI-TK. HERMAN,"JL. SILIWANGI NO.203 CICURUG,",SUKABUMI,43364,SKI-Z2CP01,"CIKEMBAR,CIKEMBANG,CIB",202
105,1,900840,SKI-TK. BERKAH,JL. SURYAKENCANA NO.2 CIBADAK,KAB. SUKABUMI,43351,SKI-Z3CP01,"WARUNG KIARA,CITARIK,",203
106,1,900841,SKI-TK. LALIH,"JL. GUDANG SAGARANTEN 24,SUKAB",KAB. SUKABUMI,43181,SKI-Z3CP02,"CIANJUR SELATAN, SAGAR",203
107,1,900842,SKI-TK. SILIH ASIH_GROUP_NA,"JL. SILIWANGI NO.203 CICURUG,",SUKABUMI,43364,SKI-RXLK02,EXP LUAR KOTA SUKABUMI,302
108,1,900849,SKI-TK. APEP (HAJI),"PS. CIKALONG BLOK C NO.9 CJR,",CIANJUR,43282,SKI-Z3CP01,"WARUNG KIARA,CITARIK,",203
109,1,900852,SKI-TK. DOA IBU LAMA,"JL. CISAAT 4/3 CITARIK, SUKABU",SUKABUMI,43152,SKI-RXPD01,EXP DALAM KOTA SUKABUM,302
110,1,900854,SKI-TK. DAMAI,JL.CIEMAS SP TK.RAJIO SUKABUMI,KAB. SUKABUMI,43177,SKI-Z3CP02,"CIANJUR SELATAN, SAGAR",203
111,1,900859,SKI-TK. MAKMUR,"PS. PANGRANGO CIPANAS, CIANJUR",CIANJUR,43253,SKI-Z3CP01,"WARUNG KIARA,CITARIK,",203
112,1,900860,SKI-TK. SUMBER REJEKI,SAMPING PS. CIBADAK SUKABUMI,KAB. SUKABUMI,43351,SKI-Z3CP01,"WARUNG KIARA,CITARIK,",202
113,1,900863,SKI-TK. YETI,"JL. CISAAT 4/3 CITARIK, SUKABU",KAB. SUKABUMI,43152,SKI-Z2CP01,"CIKEMBAR,CIKEMBANG,CIB",201
114,1,900866,SKI TK. WAWAN,"JL. CIUJUNG RT.5/1 CIDAUN CJR,",CIANJUR,43275,SKI-Z3CP02,"CIANJUR SELATAN, SAGAR",203
115,1,900873,SKI-TK. GOTONG ROYONG,BHAYANGKARA GOTONGROYONG SUKAB,SUKABUMI,43151,SKI-Z1CP01,SUKABUMI KOTA,200
116,1,900876,SKI-TK. YATI,"TERMINAL SAGARANTEN SMI, SUKAB",SUKABUMI,43181,SKI-Z3CP02,"CIANJUR SELATAN, SAGAR",210
117,1,900879,SKI-TK. ARYA,"JL. SAGARANTEN BAROS 24 SMI, S",SUKABUMI,43181,SKI-Z3CP02,"CIANJUR SELATAN, SAGAR",210
118,1,900880,SKI-TK. LIANA,"BLOK J 16 PS. PEL RATU, SUKABU",SUKABUMI,43364,SKI-Z3CP01,"WARUNG KIARA,CITARIK,",205
119,1,900881,SKI-TK. CAHAYA,JL. H. KABIR 55 SUKABUMI,SUKABUMI,43131,SKI-Z1CP01,SUKABUMI KOTA,200
120,1,900890,SKI-TK. BATUBARA II,JL. PS. PARUNG KUDA NO.6 CBDK,SUKABUMI,43351,SKI-Z3CP01,"WARUNG KIARA,CITARIK,",202
121,1,900891,SKI-TK. OOM,"JL.KALIBUNDER RT.1/2 SUKABUMI,",SUKABUMI,43185,SKI-Z3CP02,"CIANJUR SELATAN, SAGAR",210
122,1,900892,SKI-TK. SERASI,JL. CIGARU KERTAJAYA 2/2 PELTU,KAB. SUKABUMI,43364,SKI-Z2CP01,"CIKEMBAR,CIKEMBANG,CIB",201
123,1,900895,SKI-TK. MURNI,"JL. RY. UJUNG GENTENG SURADE,",SUKABUMI,43179,SKI-Z3CP02,"CIANJUR SELATAN, SAGAR",210
124,1,900896,SKI-TK. MILIK ***,JL. STASION BARAT (HOOK) - SMI,KAB. SUKABUMI,43151,SKI-Z1CP01,SUKABUMI KOTA,200
125,1,900898,SKI-TK. ANEKA TANI,"JL. BAREKBEK NO.36 SAGARANTEN,",SUKABUMI,43181,SKI-Z3CP02,"CIANJUR SELATAN, SAGAR",210
126,1,900901,SKI-TK. UJANG,JL. CITARIK NO. 6 TONJONG PELA,KAB. SUKABUMI,43364,SKI-Z2CP01,"CIKEMBAR,CIKEMBANG,CIB",201
127,1,900903,SKI-TK. RUSTANDI,JL. CIUJUNG RT.1/1 PS JYGR CJR,CIANJUR,43211,SKI-Z3CP02,"CIANJUR SELATAN, SAGAR",210
128,1,900909,SKI-TK. GUNUNG KAWI ***,JL. PASAR NO.45 SUKABUMI,KAB. SUKABUMI,43151,SKI-Z1CP01,SUKABUMI KOTA,200
129,1,900911,SKI-TK. SINAR MAS,JL. KAPT HARUN KABIR 7 SKBM,SUKABUMI,43151,SKI-Z1CP01,SUKABUMI KOTA,200
130,1,900914,SKI-TK. SIN-SIN ***,JL. PASAR BARU RUKO NO.27 CIAN,CIANJUR,43211,SKI-Z3CP01,"WARUNG KIARA,CITARIK,",203
131,1,900915,SKI-TK. BRATA WIJAYA,"JL. RY. UJUNG GENTENG SURADE,",SUKABUMI,43179,SKI-Z3CP02,"CIANJUR SELATAN, SAGAR",210
132,1,900916,SKI-TK. AYU,"JL.WALURAN NO.10 CIEMAS SMI, S",KAB. SUKABUMI,43177,SKI-Z3CP02,"CIANJUR SELATAN, SAGAR",203
133,1,900918,SKI-TK. AHU,JL. RE. MARTADINATA 20 SUKABUM,SUKABUMI,43151,SKI-Z1CP01,SUKABUMI KOTA,200
134,1,900919,SKI-TK. WIJAYA PERKASA,"JL. RY. UJUNG GENTENG SURADE,",SUKABUMI,43179,SKI-Z3CP02,"CIANJUR SELATAN, SAGAR",210
135,1,900920,SKI-TK. AEP,"JL. RY. UJUNG GENTENG SURADE,",SUKABUMI,43179,SKI-Z3CP02,"CIANJUR SELATAN, SAGAR",210
136,1,900921,SKI-TK. SURYAJAYA,JL. PEJAGALAN NO. 1 SUKABUMI,KAB. SUKABUMI,43151,SKI-Z1CP01,SUKABUMI KOTA,200
137,1,900923,SKI-TK. SARI MUTIARA,"JL. KEBON KOPI CIANJUR, CIANJU",CIANJUR,43275,SKI-Z3CP01,"WARUNG KIARA,CITARIK,",206
138,1,900925,SKI-TK. DERI PUTRA,TERM.TM.JAYA KP.TM.JAYA RT 3/2,KAB. SUKABUMI,43151,SKI-Z3CP02,"CIANJUR SELATAN, SAGAR",210
139,1,900928,SKI-TK. SARI MUTIARA,"JL. KEBON KOPI CIANJUR, CIANJU",CIANJUR,43275,SKI-RXLK01,EXP LUAR KOTA CIANJUR,301
140,1,900929,SKI-TK. SOBUR,"BLOK CI NO.98 PS.CIKALONG CJR,",CIANJUR,43291,SKI-Z3CP01,"WARUNG KIARA,CITARIK,",203
141,1,900930,SKI-TK. KARYA TANI,JL. RY. UJUNG GENTENG SURADE,SUKABUMI,43179,SKI-Z3CP02,"CIANJUR SELATAN, SAGAR",203
142,1,900931,SKI-TK. SINAR SALUYU,JL. RY. UJUNG GENTENG SURADE,SUKABUMI,43179,SKI-Z3CP02,"CIANJUR SELATAN, SAGAR",203
143,1,900932,SKI-TK. SAMI-SAMI,JL. RY A YANI 270 SUKABUMI,SUKABUMI,43151,SKI-Z1CP01,SUKABUMI KOTA,200
144,1,900933,SKI-TK. DADANG,"PS. IMPRES NO.48, CIANJUR",CIANJUR,43253,SKI-Z3CP01,"WARUNG KIARA,CITARIK,",203
145,1,900935,SKI-TK. SAGU (IBU),JL.BHAYANGKARA GG.KARAKTERDES,SUKABUMI,43151,SKI-Z1CP01,SUKABUMI KOTA,200
146,1,900936,SKI-TK. BERKAH,JL. RY. UJUNG GENTENG SURADE,SUKABUMI,43179,SKI-Z3CP02,"CIANJUR SELATAN, SAGAR",210
147,1,900939,SKI-TK. MUKHTAR,JL.SURADE KP.GN.BATU DS.TALAGA,SUKABUMI,43179,SKI-Z3CP02,"CIANJUR SELATAN, SAGAR",203
148,1,900940,SKI-TK. AL-HIKMAH,JL. RY. UJUNG GENTENG SURADE,KAB. SUKABUMI,43179,SKI-Z3CP02,"CIANJUR SELATAN, SAGAR",203
149,1,900942,SKI-TK. ZAENAL,JL. CIKADU SAGARANTEN SUKABUMI,SUKABUMI,43181,SKI-Z3CP02,"CIANJUR SELATAN, SAGAR",203
150,1,900947,SKI-TK. JASA RAMA,JL. RY. UJUNG GENTENG SURADE,SUKABUMI,43179,SKI-Z3CP02,"CIANJUR SELATAN, SAGAR",210
151,1,900948,SKI-TK. GEMILANG,JL. SURYAKENCANA 67 SUKABUMI,SUKABUMI,43151,SKI-Z2CP01,"CIKEMBAR,CIKEMBANG,CIB",201
152,1,900953,SKI-TK. SUKAJADI,JL. MANGUN SARKORO NO.178 CJR,CIANJUR,43211,SKI-Z3CP01,"WARUNG KIARA,CITARIK,",203
153,1,900955,SKI-TK. KERSA MANAH II,PSR CIRANJANG NO. 24 A CIANJUR,CIANJUR,43211,SKI-Z3CP01,"WARUNG KIARA,CITARIK,",203
154,1,900959,SKI-TK. DASEP,"JL. PELABUHAN RATU - PASAPEN,",SUKABUMI,43364,SKI-Z2CP01,"CIKEMBAR,CIKEMBANG,CIB",201
155,1,900961,SKI-TK. JAYA PUTRA,JL. CIDAUN CIANJUR SELATAN,CIANJUR,43275,SKI-Z3CP02,"CIANJUR SELATAN, SAGAR",203
156,1,900964,SKI-TK. ANAS,JL. SELAJAMBE NO 2 TUNGTURUNA,CIANJUR,43284,SKI-Z3CP01,"WARUNG KIARA,CITARIK,",203
157,1,900965,SKI-TK. NANI,JL. IR H JUANDA 4 CIANJUR,CIANJUR,43211,SKI-Z3CP01,"WARUNG KIARA,CITARIK,",203
158,1,900967,SKI-PT.RAMAYANALESTARISENTOSA (R,"JL. DR. MUWARDI II CIANJUR, CI",CIANJUR,43211,SKI-Z3CP01,"WARUNG KIARA,CITARIK,",203
159,1,900969,SKI-TK. AHLAN,JL. SURYAKENCANA 102 CISAAT SU,SUKABUMI,43152,SKI-Z1CP01,SUKABUMI KOTA,200
160,1,900971,SKI-TK. FAMILY,JL. CIJUREY KP GEGERBITUNG SMI,SUKABUMI,43197,SKI-Z3CP02,"CIANJUR SELATAN, SAGAR",210
161,1,900976,SKI-TK. RINA JAYA II,"PS. JUBLEG NO.12/13 SMI, SUKAB",SUKABUMI,43161,SKI-Z1CP01,SUKABUMI KOTA,200
162,1,900977,SKI-PT. RAMAYANA LESTARI SENTOSA,JL.TIPAR GEDE NO.17 - SUKABUMI,SUKABUMI,43141,SKI-Z1CP01,SUKABUMI KOTA,200
163,1,900978,SKI-TK. ELVAS,JL.CICIH WIARSIH NO.8 BJ.MERON,CIANJUR,43211,SKI-Z3CP01,"WARUNG KIARA,CITARIK,",203
164,1,900979,SKI-TK. SISIAN,"JL. RY LOPANG SUKABUMI, SUKABU",SUKABUMI,43151,SKI-Z3CP02,"CIANJUR SELATAN, SAGAR",203
165,1,900981,SKI-TK. AMIN,"JL. GEGER BITUNG PASANGRAHAN,",SUKABUMI,43197,SKI-Z3CP02,"CIANJUR SELATAN, SAGAR",210
166,1,900983,SKI-TK. JATI MAS,"PS. CIEMAS SMI SUKABUMI, SUKAB",KAB. SUKABUMI,43177,SKI-Z3CP02,"CIANJUR SELATAN, SAGAR",210
167,1,900984,SKI-PT. RAMAYANA (CIBADAK),JL. SILIWANGI KAMP. SEKARWANGI,KAB. SUKABUMI,43351,SKI-Z2CP01,"CIKEMBAR,CIKEMBANG,CIB",201
168,1,900985,SKI-TK. NANI 2,"KP. CIREUNDEU NYALINDUNG SMI,",KAB. SUKABUMI,43151,SKI-Z3CP02,"CIANJUR SELATAN, SAGAR",203
169,1,900988,SKI-HYPERMART MAYOFIELD CJR - 34,"JL. KH. ABDULAH BIN NUH NO. 1,",CIANJUR,43211,SKI-Z3CP01,"WARUNG KIARA,CITARIK,",203
170,1,900989,SKI-TK. ABAS,JL. BHAYANGKARA NO.20 SMI,SUKABUMI,43121,SKI-Z1CP01,SUKABUMI KOTA,200
171,1,900990,SKI-TK. AEP,"JL. SAGARANTEN SUKABUMI, SUKAB",SUKABUMI,43181,SKI-Z3CP02,"CIANJUR SELATAN, SAGAR",203
172,1,900991,SKI-TK. USMAN,PS. RAHAYU 15 CIPANAS,CIANJUR,43253,SKI-Z3CP01,"WARUNG KIARA,CITARIK,",203
173,1,900992,SKI-TK. VICTORY,JL.RY.CITAPOS CISOLOK 1/2,KAB. SUKABUMI,43366,SKI-Z3CP01,"WARUNG KIARA,CITARIK,",202
174,1,900993,SKI-TK. INSANI,JL. NANGGELENG 32 SUKABUMI,SUKABUMI,43145,SKI-Z1CP01,SUKABUMI KOTA,200
175,1,900994,SKI-MM. SIMPATI III,JL. PAKUON PA.SALAK.PRG KUDA,KAB. SUKABUMI,43357,SKI-Z3CP01,"WARUNG KIARA,CITARIK,",202
176,1,900995,SKI-TK. OSIN I,"JL.PAKUON PAR.SALAK PRG KUDA,",KAB. SUKABUMI,43357,SKI-Z3CP01,"WARUNG KIARA,CITARIK,",202
177,1,900996,SKI-TK. SURYA ABADI,"JL. PADABEUNGHAR BJ LOPANG, SU",KAB. SUKABUMI,43171,SKI-Z3CP02,"CIANJUR SELATAN, SAGAR",203
178,1,900997,SKI-TK. CAHAYA,JL. RAYA KERTAJADI CIDAUN,CIANJUR,43275,SKI-Z3CP02,"CIANJUR SELATAN, SAGAR",203
179,1,900998,SKI-TK. SEDERHANA,JL. RAYA  NYALINDUNG SUKABUMI,SUKABUMI,43196,SKI-Z3CP02,"CIANJUR SELATAN, SAGAR",210
180,1,900999,SKI-TK. PURNAMA,"JL. RY CIMACAN NO.2 CIPANAS, C",CIANJUR,43253,SKI-Z3CP01,"WARUNG KIARA,CITARIK,",206
181,1,901000,SKI-TK. WIN'S,JL. MOH ALI NO.23 / SEBELAH SE,SUKABUMI,43367,SKI-Z3CP01,"WARUNG KIARA,CITARIK,",206
182,1,901001,SKI-TK. HEDICA JAYA,"JL. RAYA CISOLOK PEL.RATU,SUKA",SUKABUMI,43364,SKI-Z3CP01,"WARUNG KIARA,CITARIK,",205
183,1,901002,SKI-TK. RAMADHAN,"PS UBRUG WR KIARA CIKOLE, SUKA",SUKABUMI,43111,SKI-Z3CP01,"WARUNG KIARA,CITARIK,",205
184,1,901003,SKI-TK. ADE,JL. SIMPANG PAGELARAN CIANJUR,CIANJUR,43266,SKI-Z3CP02,"CIANJUR SELATAN, SAGAR",210
185,1,901004,SKI-AP. RS. ASYIFA,JL. JENDRAL SUDIRMAN NO. 3 GUN,SUKABUMI,43111,SKI-Z1PH01,SUKABUMI KOTA,100
186,1,901005,SKI-TK. TIARA,"JL. RY. PURABAYA 7 SMI, SUKABU",KAB. SUKABUMI,43187,SKI-Z3CP02,"CIANJUR SELATAN, SAGAR",203
187,1,901006,SKI-TK. HADE GUNA,JL. RAYA SILIWANGI CICURUG SUK,KAB. SUKABUMI,43359,SKI-Z3CP01,"WARUNG KIARA,CITARIK,",202
188,1,901007,SKI-TK. SAHABAT,JL. CIJURAY 231 GEGER BITUNG,SUKABUMI,43197,SKI-Z3CP01,"WARUNG KIARA,CITARIK,",202
189,1,901008,SKI-AP. ANANDA,JL. IR.H. JUANDA NO.70 CIANJUR,CIANJUR,43212,SKI-Z3PH01,"CIANJUR KOTA, CIBEBER,",102
190,1,901009,SKI-TK. JASA RAMA,JL. UJUNG GENTENG CIRACAP SUKA,SUKABUMI,43176,SKI-Z3CP02,"CIANJUR SELATAN, SAGAR",210
191,1,901010,SKI-TK. UJANG,"JL. ANCAEN SAGARANTEN,SUKABUMI",SUKABUMI,43181,SKI-Z3CP02,"CIANJUR SELATAN, SAGAR",203
192,1,901011,SKI-INSTALASI GIZI RS.SAMSUDIN,JL. RUMAH SAKIT NO. 1 SUKABUMI,SUKABUMI,43111,SKI-Z1PH01,SUKABUMI KOTA,100
193,1,901012,SKI-TK. IJAH,JL. OTISTA GG. H. DAUD 2/3 SMI,SUKABUMI,43112,SKI-Z1CP01,SUKABUMI KOTA,200
194,1,901013,SKI-TK. SAMUDRA I,JL. CIUJUNG CIDAUN CIANJUR SEL,CIANJUR,43275,SKI-Z3CP02,"CIANJUR SELATAN, SAGAR",203
195,1,901014,SKI-TK. SRIKAYA,JL. A. YANI NO. 281 SUKABUMI,SUKABUMI,43151,SKI-Z1CP01,SUKABUMI KOTA,200
196,1,901015,SKI-TK. ADE MITRA,"PASAR SURADE SUKABUMI, SUKABUM",KAB. SUKABUMI,43179,SKI-Z3CP02,"CIANJUR SELATAN, SAGAR",203
197,1,901016,SKI-TK. LARIS,JL. SUKANEGARA 01/01 NO.35,CIANJUR,43264,SKI-Z3CP02,"CIANJUR SELATAN, SAGAR",203
198,1,901017,SKI-TK. HURIF JAYA,"JL. SIMPANG PAGELARAN CJR SEL,",CIANJUR,43266,SKI-Z3CP02,"CIANJUR SELATAN, SAGAR",203
199,1,901018,SKI-TK. BUDI KARYA,JL. SUKANEGARA 01/01 NO.31,CIANJUR,43264,SKI-Z3CP02,"CIANJUR SELATAN, SAGAR",203
200,1,901019,SKI-MULTI GROSIR TOSERBA,"JL. SURYA KENCANA 99 CIBADAK,",KAB. SUKABUMI,43351,SKI-Z3CP01,"WARUNG KIARA,CITARIK,",202
201,1,901020,SKI-TK. SARI ALAM,"PARUNG KUDA BLOK H NO. 15 SMI,",SUKABUMI,43357,SKI-Z2CP01,"CIKEMBAR,CIKEMBANG,CIB",202
202,1,901021,SKI-TK. ALIT,"JL. BARU EMPANG 2/13 PEL RATU,",KAB. SUKABUMI,43364,SKI-Z3CP01,"WARUNG KIARA,CITARIK,",202
203,1,901022,SKI-MM. MULTI GROSIR CICURUG,JL. SILIWANGI NO. 147 CICURUG,KAB. SUKABUMI,43359,SKI-Z3CP01,"WARUNG KIARA,CITARIK,",202
204,1,901023,SKI-TK. MANG DANISH,"PS. PEL.RATU J32 SUKABUMI, SUK",SUKABUMI,43364,SKI-Z3CP01,"WARUNG KIARA,CITARIK,",202
205,1,901024,SKI-TK. KARYA PUTRI,"JL. CIKANGKUNG SURADE, SUKABUM",KAB. SUKABUMI,43179,SKI-Z3CP02,"CIANJUR SELATAN, SAGAR",210
206,1,901025,SKI-TK. BERKAH RUTIN,"JL. BANTEN CISOLOK SUKABUMI, S",KAB. SUKABUMI,43366,SKI-Z3CP01,"WARUNG KIARA,CITARIK,",202
207,1,901026,SKI-AP. NIAS,JL. PELABUHAN NO. 63A SUKABUMI,KAB. SUKABUMI,43364,SKI-Z1PH01,SUKABUMI KOTA,100
208,1,901027,SKI-TK. DIAN PUTRA,JL. CIKARANG 9/7 SURADE SUKABU,SUKABUMI,43179,SKI-Z3CP02,"CIANJUR SELATAN, SAGAR",203
209,1,901028,SKI-TK. MANFAAT PUTRA,"PS. PURABAYA SAGARANTEN, SUKAB",SUKABUMI,43187,SKI-Z3CP02,"CIANJUR SELATAN, SAGAR",210
210,1,901030,SKI-TK. SS,"CITARIK PS. TONJONG PEL. RATU,",KAB. SUKABUMI,43364,SKI-Z2CP01,"CIKEMBAR,CIKEMBANG,CIB",201
211,1,901031,SKI-SUPER INDO SUKABUMI,JL. A.YANI NO.125-127 SUKABUMI,KAB. SUKABUMI,43151,SKI-Z1CP01,SUKABUMI KOTA,200
212,1,901032,SKI-TK. ADS,JL. PASAR CIWANGI 4 SUKABUMI,SUKABUMI,43151,SKI-Z1CP01,SUKABUMI KOTA,200
213,1,901033,SKI-TK. RAHMA,"JL. CIEMAS SURADE SUKABUMI, SU",KAB. SUKABUMI,43177,SKI-Z3CP02,"CIANJUR SELATAN, SAGAR",210
214,1,901034,SKI-KLINIK IRNA FARMA,JL. BHAYANGKARA NO.30 SUKABUMI,SUKABUMI,43123,SKI-Z1PH01,SUKABUMI KOTA,100
215,1,901035,SKI-TK. GELAR ANYAR,"JL. PS CIBEBER CJR SELATAN, CI",CIANJUR,43262,SKI-Z3CP01,"WARUNG KIARA,CITARIK,",203
216,1,901036,SKI-MITRA GROSIR TOSERBA,JL. SILIWANGI NO. 60A CIANJUR,CIANJUR,43212,SKI-Z3CP01,"WARUNG KIARA,CITARIK,",203
217,1,901037,SKI-TK. RIDWAN,"JL. SAGARANTEN SUKABUMI, SUKAB",SUKABUMI,43181,SKI-Z3CP02,"CIANJUR SELATAN, SAGAR",210
218,1,901039,SKI-MM. MITRA JAYA,"JL. PS SUKANEGARA CJR SEL, CIA",CIANJUR,43264,SKI-Z3CP02,"CIANJUR SELATAN, SAGAR",203
219,1,901040,SKI-TIARA TOSERBA,JL. A.YANI NO.2 RT.3 RW.5 SUKA,SUKABUMI,43131,SKI-Z1CP01,SUKABUMI KOTA,200
220,1,901041,SKI-TK. SR,JL. RY CIREUNGHAS NO.100 SMI,KAB. SUKABUMI,43193,SKI-Z3CP02,"CIANJUR SELATAN, SAGAR",203
221,1,901043,SKI - BGR,Jl. Raya Wangun No.216 Tajur,BOGOR,,SKI-Z4,SKI Z4,300
222,1,901042,SKI-TIARA TOSERBA (CJR),"JL. SITI JENAB NO.8/10, CIANJU",CIANJUR,43215,SKI-Z3CP01,"WARUNG KIARA,CITARIK,",203
223,1,901044,SKI-TK. LUGINA,"JL. LUHUR SINDANGBARANG CJR, C",CIANJUR,43272,SKI-Z3CP02,"CIANJUR SELATAN, SAGAR",203
224,1,901045,BGR - SKI,Jl. Sukabumi no 10,Sukabumi,,SKI-Z4,SKI Z4,300
225,1,901046,SKI-TK. NS PUTRA,"JL. AGRA GINTA 50 M, CIANJUR",CIANJUR,43273,SKI-Z3CP02,"CIANJUR SELATAN, SAGAR",203
226,1,901047,SKI-TK. BATUBARA PUTRA,"PS. PARUNG KUDA H/1 SMI, SUKAB",SUKABUMI,43357,SKI-Z2CP01,"CIKEMBAR,CIKEMBANG,CIB",202
227,1,901048,SKI-TK. DADANG,"KP. SAWAH RANDU 2/1 CJATI, CIA",CIANJUR,43268,SKI-Z3CP02,"CIANJUR SELATAN, SAGAR",210
228,1,901049,SKI-TK. NANI 2,JL. RY NYALINDUNG SUKABUMI,KAB. SUKABUMI,43196,SKI-Z3CP02,"CIANJUR SELATAN, SAGAR",203
