2110,1,978157,SKI-TK. PUTRA KERAMAT,JL. KARAMAT RT.02 RW.04 KADUPA,CIANJUR,43268,SKI-Z3CP02,"CIANJUR SELATAN, SAGAR",203
2111,1,978158,SKI-TK. ADE BARAT,JL. RY. CIJATI RT.01 RW.01 KP.,CIANJUR,43284,SKI-Z3CP02,"CIANJUR SELATAN, SAGAR",203
2112,1,978159,SKI-TK. ESA SETIA,KP. PASAR RT.01 RW.01 CIJATI C,CIANJUR,43284,SKI-Z3CP02,"CIANJUR SELATAN, SAGAR",203
2113,1,978205,SKI-TK. MOCHI KASWARI,JL. BHAYANGKARA GG. KASWARI NO,SUKABUMI,43114,SKI-Z1CP01,SUKABUMI KOTA,200
2114,1,978206,SKI-TK. HONI,JL. SALABINTANA KARAWANG SUKAB,SUKABUMI,43151,SKI-Z1CP01,SUKABUMI KOTA,200
2115,1,978207,SKI-TK. INDRA,JL. SALABINTANA KARAWANG,SUKABUMI,43151,SKI-Z1CP01,SUKABUMI KOTA,200
2116,1,978208,SKI-TK. AJAZZ,JL. SALABINTANA KARAWANG SUKAB,SUKABUMI,43151,SKI-Z1CP01,SUKABUMI KOTA,200
2117,1,978209,SKI-TK. SUSI,JL. SALABINTANA KARAWANG SUKAB,SUKABUMI,43151,SKI-Z1CP01,SUKABUMI KOTA,200
2118,1,978210,SKI-TK. RISMA,JL. SALABINTANA KARAWANG SUKAB,SUKABUMI,43151,SKI-Z1CP01,SUKABUMI KOTA,200
2119,1,978211,SKI-TK. SAMRATUS SURUS,JL. SALABINTANA KARAWANG SUKAB,SUKABUMI,43151,SKI-Z1CP01,SUKABUMI KOTA,200
2120,1,978213,SKI-WR. IKA,JL. SALABINTANA KARAWANG SUKAB,SUKABUMI,43151,SKI-Z1CP01,SUKABUMI KOTA,200
2121,1,978214,SKI-RM. IBU NANI,JL. SALABINTANA KARAWANG RT.3/,SUKABUMI,43151,SKI-Z1CP01,SUKABUMI KOTA,200
2122,1,978215,SKI-RM. ABAH ENUN,JL. SALABINTANA KARAWANG RT.6/,SUKABUMI,43151,SKI-Z1CP01,SUKABUMI KOTA,200
2123,1,978218,SKI-TK. MOCHI KASWARI,JL. KASWARI SELABATU CIKOLE,SUKABUMI,43114,SKI-Z1CP01,SUKABUMI KOTA,200
2124,1,978247,SKI-TK. WADI,JL. PARUNG KUDA SUKABUMI,SUKABUMI,43357,SKI-Z2CP01,"CIKEMBAR,CIKEMBANG,CIB",201
2125,1,978248,SKI-TK. DEWI,JL. PARUNG KUDA SUKABUMI,SUKABUMI,43357,SKI-Z2CP01,"CIKEMBAR,CIKEMBANG,CIB",201
2126,1,978249,SKI-TK. RIZAL,"JL. NAGRAK, NAGRAK SELATAN",SUKABUMI,43356,SKI-Z2CP01,"CIKEMBAR,CIKEMBANG,CIB",201
2127,1,978286,SKI-TK. PADLI,JL. TELAGA TENGAH CARINGIN KUL,SUKABUMI,43154,SKI-Z2CP01,"CIKEMBAR,CIKEMBANG,CIB",201
2128,1,978289,SKI-RM IBU AAT,TELAGA TENGAH CARINGIN KULON S,SUKABUMI,43154,SKI-Z1CP01,SUKABUMI KOTA,200
2129,1,978346,SKI-TK. CHA CHA,PS. INDUK PASIR HAYAM PERTOKOA,CIANJUR,43285,SKI-Z3CP01,"WARUNG KIARA,CITARIK,",202
2130,1,978347,SKI-TK. HADI,JL. RY. SUKARAJA SUKABUMI,SUKABUMI,43192,SKI-Z1CP01,SUKABUMI KOTA,200
2131,1,978348,SKI-WARTEG IBU MIMIN,JL. RY. SUKARAJA SUKABUMI,SUKABUMI,43192,SKI-Z1CP01,SUKABUMI KOTA,200
2132,1,978432,SKI-TK. MILKY SUSU,JL. IR. H. JUANDA NO.69 SELAKO,CIANJUR,43212,SKI-Z3CP01,"WARUNG KIARA,CITARIK,",202
2133,1,978827,SKI-TO. SALWI FARMA,JL. RY. SILIWANGI KM.35 DPN GG,SUKABUMI,43359,SKI-Z3CP01,"WARUNG KIARA,CITARIK,",202
2134,1,979315,SKI-AP. MUTIARA FARMA,KP. BAGBAGAN RT.002 RW.009 PEL,SUKABUMI,43364,SKI-Z2PH01,"PALABUHAN RATU, SURADE",301
2135,1,979345,"SKI-PT. SUMBER ALFARIA TRIJAYA,",JL. RY. SUKABUMI KP. CIENDEUR,CIANJUR,43261,SKI-Z3CP01,"WARUNG KIARA,CITARIK,",202
2136,1,979358,SKI-TK. ASGAR,JL. CEMERLANG KUBANG NO.65 RT.,SUKABUMI,43135,SKI-Z1CP01,SUKABUMI KOTA,200
2137,1,979359,SKI-TK. BUMI JAYA,JL. CEMERLANG NO.60 RT.1/1 KEL,SUKABUMI,43135,SKI-Z1CP01,SUKABUMI KOTA,200
2138,1,979482,SKI-TK. SODAKALA,JL. CIDOLOG RT.07/02 CURUG LUH,SUKABUMI,43181,SKI-Z3CP02,"CIANJUR SELATAN, SAGAR",210
2139,1,979483,SKI-TK. RIZKY JAYA,JL. SAGARANTEN RT.04 RW.02 KP.,SUKABUMI,43181,SKI-Z3CP02,"CIANJUR SELATAN, SAGAR",210
2140,1,979569,SKI - PDG,Jl.  BY PASS KM 10 KURANJI,PADANG,,SKI-Z4,SKI Z4,300
2141,1,979788,SKI-RSUD AL-MULK,JL. PELABUHAN II KM. 6 LEMBURS,SUKABUMI,43169,SKI-Z2PH01,"PALABUHAN RATU, SURADE",102
2142,1,979958,SKI-TK. SYARIAH,JL. RY. CIANJUR BANDUNG HEGARM,CIANJUR,43284,SKI-Z3CP01,"WARUNG KIARA,CITARIK,",302
2143,1,980432,SKI - PKP,Jl. Jend. Sudirman No. 03 RT 0,Pangkal Balam,,SKI-Z4,SKI Z4,300
2144,1,980469,SKI-TK. GROSIR MUNGGARAN,JL. GUNTENG KARANG TENGAH CIAN,CIANJUR,43281,SKI-Z3CP01,"WARUNG KIARA,CITARIK,",202
2145,1,980644,SKI-TK. SUSI,JL. VETERAN KP. CIBATU RT.019/,SUKABUMI,43152,SKI-Z1CP01,SUKABUMI KOTA,200
2146,1,980647,SKI-TK. AMANAH,JL. VETERAN SAMPING YASTI RT.0,SUKABUMI,43152,SKI-Z1CP01,SUKABUMI KOTA,200
2147,1,980888,SKI-TK. MAYA,KP. SINAR MULYA RT.3/3 SUKAMAN,CIANJUR,43262,SKI-Z3CP01,"WARUNG KIARA,CITARIK,",202
2148,1,980890,SKI-TK. ARIEF,JL. CEMPAKA SELAGEDANG RT.02/1,CIANJUR,43262,SKI-Z3CP01,"WARUNG KIARA,CITARIK,",202
2149,1,980891,SKI-TK. FM,KP. BABAKAN SUKAKARYA SUKANEGA,CIANJUR,43264,SKI-Z3CP01,"WARUNG KIARA,CITARIK,",202
2150,1,980893,SKI-TK. H. AEP,JL. KADUPANDAK KP. CIBURIAL RT,CIANJUR,43268,SKI-Z3CP01,"WARUNG KIARA,CITARIK,",202
2151,1,980894,SKI-TK. MBA,JL. PANYEBRANGAN RT.02/01 GN.,CIANJUR,43264,SKI-Z3CP02,"CIANJUR SELATAN, SAGAR",203
2152,1,980896,SKI-TK. PUTRA WIJAYA,JL. PADJAJARAN RT.01/03 SINDAN,CIANJUR,43268,SKI-Z3CP02,"CIANJUR SELATAN, SAGAR",203
2153,1,980897,SKI-TK. MANDIRI,KP. RAWA BANEN RT.02/03 SUKARA,CIANJUR,43268,SKI-Z3CP02,"CIANJUR SELATAN, SAGAR",203
2154,1,980898,SKI-TK. UTAMA,KP. CIPAGAN RT.03/02 GANDASARI,CIANJUR,43268,SKI-Z3CP02,"CIANJUR SELATAN, SAGAR",203
2155,1,980913,SKI-RMA,JL. RAYA CIBOLANG NO.21 RT.04,SUKABUMI,43152,SKI-Z1CP01,SUKABUMI KOTA,100
2156,1,980925,SKI-KLINIK DKT PANGRANGO,"JL. PGRI NO.08 GUNUNGPARANG, C",SUKABUMI,43113,SKI-Z1PH01,SUKABUMI KOTA,100
2157,1,980926,SKI-TK. ADE,KP. CIBARENGKOK RT.02 RW.06 BO,CIANJUR,43267,SKI-Z3CP02,"CIANJUR SELATAN, SAGAR",203
2158,1,980927,SKI-TK. WIJAYA,KP. NYALEMPET RT.01 RW.02 KADU,CIANJUR,43268,SKI-Z3CP02,"CIANJUR SELATAN, SAGAR",203
2159,1,980928,SKI-TK. ELIS,JL. SUKANEGARA KP. CIAWI TALI,CIANJUR,43264,SKI-Z3CP02,"CIANJUR SELATAN, SAGAR",203
2160,1,980930,SKI-TK. RAHMAT,JL. SIRNAGALIH RT.08 RW.05 SUK,CIANJUR,43264,SKI-Z3CP02,"CIANJUR SELATAN, SAGAR",302
2161,1,980986,SKI-AP. RIZKI FARMA,KOMPLEK PASAR PELABUHAN RATU B,SUKABUMI,43364,SKI-Z2PH01,"PALABUHAN RATU, SURADE",201
2162,1,981091,SKI-TK. CS,"JL. SELABINTANA KM. 3,5 KP. PA",SUKABUMI,43151,SKI-Z1CP01,SUKABUMI KOTA,200
2163,1,981190,SKI-TK. HERU,JL. AGRABINTA RT.03/02 TALAGA,CIANJUR,43272,SKI-Z3CP02,"CIANJUR SELATAN, SAGAR",203
2164,1,981288,SKI-AP. KIMIA FARMA 549,"JL. NGAWENG NO. 36 SUKARAJA, K",SUKABUMI,43192,SKI-Z1PH01,SUKABUMI KOTA,100
2165,1,981309,SKI-PT. KARTIKA PARAMA MEDIKA,JL. A. YANI NO.18 NYOMPLONG WA,SUKABUMI,43131,SKI-Z1PH01,SUKABUMI KOTA,100
2166,1,981345,SKI-AP. ABA MEDICA,"JL. GARUDA NO.20C BAROS, KOTA",SUKABUMI,43161,SKI-Z1PH01,SUKABUMI KOTA,100
2167,1,981464,SKI-AP. MUTIARA FARMA,KP. BAGBAGAN RT.002 RW.009 JAY,SUKABUMI,43364,SKI-Z3PH01,"CIANJUR KOTA, CIBEBER,",103
2168,1,981477,SKI-KLINIK ALTHA MEDIKA DUA,JL. SILIWANGI NO.5 RT.029 RW.0,SUKABUMI,43357,SKI-Z2PH01,"PALABUHAN RATU, SURADE",101
2169,1,981478,SKI-AP. RAHAYU,JL. RY. CISAAT NO.151 RT.005 R,SUKABUMI,43152,SKI-Z1PH01,SUKABUMI KOTA,100
2170,1,981671,SKI-TO. GELORA MEDIKA,JL. MARIWATI DPN. PASAR GSP CI,CIANJUR,43254,SKI-Z3CP01,"WARUNG KIARA,CITARIK,",202
2171,1,981672,SKI-TK. REVAL,KP. BAROS PASANGGRAHAN RT.04/0,SUKABUMI,43181,SKI-Z3CP02,"CIANJUR SELATAN, SAGAR",203
2172,1,981673,SKI-TK. H. KOSASIH,KP. CIKETA RT.05/02 GN. BENTAN,SUKABUMI,43181,SKI-Z3CP02,"CIANJUR SELATAN, SAGAR",203
2173,1,981674,SKI-RM. ITEUNG,JL. BHAYANGKARA RT.001/006 PEL,SUKABUMI,43364,SKI-Z3CP01,"WARUNG KIARA,CITARIK,",202
2174,1,981941,SKI-RM. SINAR GARUDA,JL. PARAKAN SALAK RT.003 RW.00,SUKABUMI,43355,SKI-Z2CP01,"CIKEMBAR,CIKEMBANG,CIB",201
2175,1,981942,SKI-TK. LALA,JL. GARDUH RT.006 RW.002 BOJON,SUKABUMI,43355,SKI-Z2CP01,"CIKEMBAR,CIKEMBANG,CIB",201
2176,1,982152,SKI-TK. AL HADI,JL. RY. WR. KONDANG BUNISARI (,CIANJUR,43261,SKI-Z3CP01,"WARUNG KIARA,CITARIK,",202
2177,1,982153,SKI-TO. KAISAR,JL. RY. GUNTENG NO.2 KARANG TE,CIANJUR,43281,SKI-Z3CP01,"WARUNG KIARA,CITARIK,",202
2178,1,982154,SKI-TO. ZULFA,JL. RY. SUKABUMI RANCAGOONG CI,CIANJUR,43285,SKI-Z3PH01,"CIANJUR KOTA, CIBEBER,",102
2179,1,982379,SKI-TK. RAKA,JL. TANGGEUNG RT.1/4 BOJONGPET,CIANJUR,43267,SKI-Z3CP02,"CIANJUR SELATAN, SAGAR",203
2180,1,982382,SKI-TK. HARUM JAYA,JL. RY. SUKANAGARA KP. CIHARUM,CIANJUR,43264,SKI-Z3CP02,"CIANJUR SELATAN, SAGAR",203
2181,1,982433,SKI-TK. AFIFAH,"JL. PAJAJARAN SUKAMANTRI, CISA",SUKABUMI,43152,SKI-Z1CP01,SUKABUMI KOTA,200
2182,1,982908,SKI-TC. ALFAMS,JL. RY. GALUMPIT RT.20/5 SUKAM,SUKABUMI,43175,SKI-Z3CP01,"WARUNG KIARA,CITARIK,",201
2183,1,982985,SKI-RSUD. SAYANG,JL. RUMAH SAKIT NO. 1 CIANJUR,CIANJUR,43216,SKI-Z3PH01,"CIANJUR KOTA, CIBEBER,",102
2184,1,983058,SKI-AP. KIMIA FARMA 221,JL. JENDRAL SUDIRMAN NO.81 B K,SUKABUMI,43132,SKI-Z1PH01,SUKABUMI KOTA,100
2185,1,983088,SKI-PT. DARUTAQWA SUKABUMI,JL. RE. MARTADINATA NO.39 RT.0,SUKABUMI,43113,SKI-Z3CP01,"WARUNG KIARA,CITARIK,",203
2186,1,983148,SKI-RSUD. SEKARWANGI,JL. SILIWANGI NO.49 CIBADAK SU,SUKABUMI,43351,SKI-Z2PH01,"PALABUHAN RATU, SURADE",101
2187,1,983149,SKI-TK. FAJAR BARU,JL. RY. CIPANAS NO. 32,CIANJUR,43253,SKI-Z3CP01,"WARUNG KIARA,CITARIK,",202
2188,1,983150,SKI-AVONDI PETSHOP,JL. AHMAD YANI NO.311 KEBONJAT,SUKABUMI,43112,SKI-Z1CP01,SUKABUMI KOTA,200
2189,1,983185,SKI-SC. GARUDA FUTSAL,JL. RA. KOSASIH GG. KOKOM NO.2,SUKABUMI,43116,SKI-Z1CP01,SUKABUMI KOTA,200
2190,1,983188,SKI-TK. ZIA,JL. PELABUHAN II  WR.KELAPA SI,SUKABUMI,43169,SKI-Z1CP01,SUKABUMI KOTA,200
2191,1,983363,SKI-TK. BERKAH GROSIR,JL. BERKAH RT.08/02 BOJONG GEN,SUKABUMI,43353,SKI-Z2CP01,"CIKEMBAR,CIKEMBANG,CIB",201
2192,1,983642,SKI-VIN'Z PETSHOP,JL. BARISAN BENTENG NO.27 B SO,CIANJUR,43214,SKI-Z3CP01,"WARUNG KIARA,CITARIK,",202
2193,1,983844,SKI-AP. ELKA FARMA,JL. GUDANG NO.36 RT.001 RW.005,SUKABUMI,43113,SKI-Z1PH01,SUKABUMI KOTA,100
2194,1,983992,SKI-TK. PUTRA MANDIRI FOOD,"JL. SILIWANGI, BENDA, CICURUG,",SUKABUMI,43359,SKI-Z3CP01,"WARUNG KIARA,CITARIK,",202
2195,1,983993,SKI-TK. GROSIR PELANGI,JL. SILIWANGI RT.01/01 BENDA C,SUKABUMI,43359,SKI-Z3CP01,"WARUNG KIARA,CITARIK,",202
2196,1,984054,SKI - DPS,Jl. Raya Lukluk No. 115 Badung,BALI,,SKI-Z4,SKI Z4,300
2197,1,984561,SKI-TC. SEHAT,JL. KABANDUNGAN 53 SUKABUMI,SUKABUMI,43368,SKI-Z3CP01,"WARUNG KIARA,CITARIK,",202
2198,1,984585,SKI-TK. SINAR REJEKI JAYA,JL. MANGKUPRAJA NO.54 DPN SD N,CIANJUR,43215,SKI-Z3CP01,"WARUNG KIARA,CITARIK,",202
2199,1,984693,SKI-BINTANG PETSHOP,JL. KH. A. SANUSI NO.85 DPN BJ,SUKABUMI,43121,SKI-Z1CP01,SUKABUMI KOTA,200
2200,1,984694,SKI-MEMO PETSHOP,JL. RY. CIBATU NO 9 DPN. AP. C,SUKABUMI,43152,SKI-Z1CP01,SUKABUMI KOTA,200
2201,1,984824,SKI-TK. MAKMUR,JL. RAYA CIPANAS NO.177 CIANJU,CIANJUR,43253,SKI-Z3CP01,"WARUNG KIARA,CITARIK,",202
2202,1,987280,SKI-TC. CAHAYA,JL. CAGAK CIREUNDEU PERTIGAAN,SUKABUMI,43351,SKI-Z2CP01,"CIKEMBAR,CIKEMBANG,CIB",201
2203,1,987282,SKI-TC. INDOWARAS,JL. CIBARAJA NO.10 DPN. PS. IK,SUKABUMI,43152,SKI-Z1CP01,SUKABUMI KOTA,200
2204,1,987526,SKI-PUSKESMAS DTP CIRANJANG,JL. RUMAH SAKIT NO.194 CIRANJA,CIANJUR,43282,SKI-Z3PH01,"CIANJUR KOTA, CIBEBER,",102
2205,1,987622,SKI-TK. KIRI KANAN (H.IYUS),JL. BALANDONGANLIO SANTA RT.01,SUKABUMI,43142,SKI-Z1CP01,SUKABUMI KOTA,200
2206,1,987653,SKI-AP. MITRA LESTARI CIANJUR,JL. ABDULLAH BIN NUH RUKO BLOK,CIANJUR,43216,SKI-Z3PH01,"CIANJUR KOTA, CIBEBER,",301
2207,1,987688,SKI-AP. SONIA,JL. IR. H. DJUANDA NO.57 CIANJ,CIANJUR,43281,SKI-Z3PH01,"CIANJUR KOTA, CIBEBER,",102
2208,1,988007,SKI-TK. LARIS,JL. SILIWANGI NO.81 BSAMPING K,SUKABUMI,43351,SKI-Z3CP01,"WARUNG KIARA,CITARIK,",202
2209,1,988008,SKI-WASERBA AL MANSHUR,JL. CIBARAJA RT.002/001 PS. IK,SUKABUMI,43152,SKI-Z1CP01,SUKABUMI KOTA,200
2210,1,988149,SKI-TK. YUNI III,"JL. PASIR ANGIN, MUNJUL, CIAMB",SUKABUMI,43356,SKI-Z3CP01,"WARUNG KIARA,CITARIK,",202
2211,1,988175,SKI - PTK,"JL. ARTERI SUPADIO ,KOMP. PERG",PONTIANAK,,SKI-Z4,SKI Z4,300
2212,1,988182,SKI-AP. AFIFAH,JL. PAJAJARAN 1 NO.12 RT.002/0,SUKABUMI,43152,SKI-Z1PH01,SUKABUMI KOTA,100
2213,1,988237,SKI-PT. SURYA MITRA MILIK,JL. STASION BARAT NO.03 RT.005,SUKABUMI,43111,SKI-Z1CP01,SUKABUMI KOTA,200
2214,1,988340,SKI-TK. JAYA SARI,TERMINAL BWH SUKARAJA DPN. TK.,SUKABUMI,43192,SKI-Z1CP01,SUKABUMI KOTA,301
2215,1,988365,SKI-AP. TRI FARMA,JL. SELABINTANA NO.16 CIMANGGA,SUKABUMI,43115,SKI-Z1PH01,SUKABUMI KOTA,301
2216,1,988593,SKI-SPORT GARDEN MARKET,JL. PEL. II KM 4 CIPANENGAH LE,SUKABUMI,43167,SKI-Z1CP01,SUKABUMI KOTA,200
2217,1,988763,SKI-TK. NENAH,JL. KADUDAMPIT RT.19/02 KALAPA,SUKABUMI,43354,SKI-Z3CP01,"WARUNG KIARA,CITARIK,",203
2218,1,988795,SKI-TK. SINAR MULYA,JL. KP. GIRANG DS. CIDAMAR RT.,CIANJUR,43275,SKI-Z3CP02,"CIANJUR SELATAN, SAGAR",303
2219,1,988798,SKI-TK. DUA PUTRI,JL. CINANGKEROK RT.11/3 BATULA,CIANJUR,43271,SKI-Z3CP01,"WARUNG KIARA,CITARIK,",303
2220,1,988876,SKI-TK. HSB/HASIBUAN,KP. CIGADOG LANGENSARI SUKARAJ,SUKABUMI,43192,SKI-Z3CP01,"WARUNG KIARA,CITARIK,",303
2221,1,988972,SKI-TK. MANDIRI,"JL. CIKALONG RT.1/4 CINANGSI,",CIANJUR,43291,SKI-Z3CP01,"WARUNG KIARA,CITARIK,",301
2222,1,989525,SKI-AP. VANO FARMA,JL. RAYA CIANJUR-SUKABUMI GEKB,CIANJUR,43261,SKI-Z3PH01,"CIANJUR KOTA, CIBEBER,",302
2223,1,989527,SKI-TK. MAMAT,JL. SIMPANG TIGA CIHEULANG RT.,SUKABUMI,43351,SKI-Z3CP01,"WARUNG KIARA,CITARIK,",202
2224,1,989638,SKI-TK. WAHYU,JL. AL MUWAHIDIN RT.02/03 KRG.,SUKABUMI,43351,SKI-Z2CP01,"CIKEMBAR,CIKEMBANG,CIB",302
2225,1,989709,SKI-RS. KARTIKA MEDICAL CENTER,JL. JEND. A. YANI NO.18 A KEL.,SUKABUMI,43131,SKI-Z1PH01,SUKABUMI KOTA,100
2226,1,989849,SKI-AP. KEISHA,JL. IR. H. JUANDA NO.85 CIANJU,CIANJUR,43211,SKI-Z3PH01,"CIANJUR KOTA, CIBEBER,",302
2227,1,989957,SKI-TK. RHS,JL. PELABUHAN II KM.3 LEMBURSI,SUKABUMI,43169,SKI-Z1CP01,SUKABUMI KOTA,200
2228,1,990036,SKI-AP. ARSAKHA FARMA,KP. CIKUKULU CISANDE CICANTAYA,SUKABUMI,43155,SKI-Z2PH01,"PALABUHAN RATU, SURADE",202
2229,1,990156,SKI-TK. TIGA SEKAWAN,KP. SINDANG LAKA RT.05/07 BATU,CIANJUR,43253,SKI-Z3CP01,"WARUNG KIARA,CITARIK,",302
2230,1,990157,SKI-TK. WULAN,"DS. BATULAYANG RT.02/07 LOJI,",CIANJUR,43253,SKI-Z3CP01,"WARUNG KIARA,CITARIK,",302
2231,1,990158,SKI-AP. ANNISYAR FARMA,"JL. BAROS 128A JAYARAKSA, SUKA",SUKABUMI,43166,SKI-Z2PH01,"PALABUHAN RATU, SURADE",102
2232,1,990463,SKI-MM. JPJ/JAYA PADA JAYA,JL. MARWATI RT.002/002 KP. TAR,CIANJUR,43291,SKI-Z3CP02,"CIANJUR SELATAN, SAGAR",302
2233,1,990500,SKI-TK. BUBUN,JL. LEMBUR KALER RT.4/5 KADEMA,CIANJUR,43292,SKI-Z3CP01,"WARUNG KIARA,CITARIK,",302
2234,1,990501,SKI-TK. SAEPUL,"JL. MANDE RT.01/01 SUKAJADI, K",CIANJUR,43281,SKI-Z3CP01,"WARUNG KIARA,CITARIK,",203
2235,1,990769,SKI-PT. PANJUNAN BDG,JL. SOEKARNO HATTA NO.40 BANDU,BANDUNG,40212,SKI-Z3CP01,"WARUNG KIARA,CITARIK,",203
2236,1,990820,SKI-TK. SAHABAT,JL. CIGARU KAMPUNG CIGADOG RT.,SUKABUMI,43361,SKI-Z3CP02,"CIANJUR SELATAN, SAGAR",302
2237,1,990826,SKI-AP. TJIANDJUR,JL. K.H. HASYIM ASHARI NO. 63,CIANJUR,43214,SKI-Z3PH01,"CIANJUR KOTA, CIBEBER,",301
2238,1,990832,SKI-AP. RIZQIA MEDIKA,JL. RAYA CISAAT RT.001 RW.001,SUKABUMI,43152,SKI-Z1PH01,SUKABUMI KOTA,301
2239,1,991901,SKI-AP. MJ FARMA,KP. BABAKAN ANYAR RT.002 RW.00,SUKABUMI,43351,SKI-Z3PH01,"CIANJUR KOTA, CIBEBER,",102
2240,1,992856,SKI-AP. KIMIA FARMA PELABUHAN RA,"JL. SILIWANGI RT 002 RW 018, K",SUKABUMI,43364,SKI-Z2PH01,"PALABUHAN RATU, SURADE",102
2241,1,992912,SKI-AP. JAMPANG MEDIKA,JL. CIBARUSAH KP. MANDALA RT.0,SUKABUMI,43178,SKI-Z3PH01,"CIANJUR KOTA, CIBEBER,",102
2242,1,992913,SKI-CV. RATU CATHERING,JL. SILIWANGI GG. H. MARZUKI N,SUKABUMI,43112,SKI-Z1PH01,SUKABUMI KOTA,200
2243,1,993314,SKI-KLINIK BEBITA,JL. RAYA LEGOS NO.59 RT. 002 R,SUKABUMI,43359,SKI-Z3PH01,"CIANJUR KOTA, CIBEBER,",102
2244,1,993379,SKI-AP. KIMIA FARMA CISAAT,JL. RY. CIBOLANG DS. CIBOLANG,SUKABUMI,43152,SKI-Z1PH01,SUKABUMI KOTA,201
2245,1,993383,SKI-PRATAMA PET & POULTRY SHOP,JL. RY. CISAAT RT.07/02 DEPAN,SUKABUMI,43152,SKI-Z1CP01,SUKABUMI KOTA,201
2246,1,993384,SKI-TC. ZAM-ZAM,PS. CISAAT BLOK KA NO.12 SUKAM,SUKABUMI,43152,SKI-Z1CP01,SUKABUMI KOTA,201
2247,1,993456,SKI-TK. BY,"PS. CISAAT BLOK KB NO.3, SUKAM",SUKABUMI,43152,SKI-Z1CP01,SUKABUMI KOTA,201
2248,1,993517,SKI-AP. WARAS MEDIKA,"JL. SUKARAJA NO.109 SUKARAJA,",SUKABUMI,43192,SKI-Z1PH01,SUKABUMI KOTA,201
2249,1,993553,SKI-AP. BUANA FARMA,"JL. PRAMUKA DS. BOJONG, KARANG",CIANJUR,43281,SKI-Z3PH01,"CIANJUR KOTA, CIBEBER,",301
2250,1,993554,SKI-AP. LILY,JL. ARIEF RAHMAN HAKIM NO.24C,CIANJUR,43215,SKI-Z3PH01,"CIANJUR KOTA, CIBEBER,",301
2251,1,993556,SKI-RSUD PAGELARAN,"JL. RAYA PAGELARAN NO.18, PAGE",CIANJUR,43266,SKI-Z3PH01,"CIANJUR KOTA, CIBEBER,",301
2252,1,993557,SKI-AP. KIMIA FARMA 365,JL. IR. H. JUANDA NO.15 RT.01,CIANJUR,43211,SKI-Z3PH01,"CIANJUR KOTA, CIBEBER,",301
2253,1,993558,SKI-AP. KIMIA FARMA 317,JL. DR. MUWARDI NO.150E KEL. S,CIANJUR,43212,SKI-Z3PH01,"CIANJUR KOTA, CIBEBER,",301
2254,1,993719,SKI-PT. SANGHIANG PERKASA,GEDUNG GRAHA KIRANA LT.5 JL. Y,JAKARTA UTARA,14360,SKI-Z1CP01,SUKABUMI KOTA,201
2255,1,993888,SKI-MM. SARANA REZEKI PRIMA,JL. SILIWANGI NO.185 CIBADAK K,SUKABUMI,43351,SKI-Z2CP02,"PARUNG KUDA, PARAKAN S",201
2256,1,993913,SKI-TK. LIA,PERUM GRIYA PRATAMA BLOK C4 NO,SUKABUMI,43115,SKI-Z1CP01,SUKABUMI KOTA,200
2257,1,993914,SKI-MHB MART,JL. RUMAH SAKIT BUNUT BELAKANG,SUKABUMI,43113,SKI-Z1CP01,SUKABUMI KOTA,200
2258,1,994349,SKI-AP. ADINDA FARMA,JL. ARIA CIKONDANG NO. 17 CIAN,CIANJUR,43213,SKI-Z3PH01,"CIANJUR KOTA, CIBEBER,",201
2259,1,994419,SKI-AP. KIMIA FARMA 335,JL. RAYA SILIWANGI NO. 416 CIC,SUKABUMI,43359,SKI-Z2PH01,"PALABUHAN RATU, SURADE",102
2260,1,994747,SKI-AP. KIMIA FARMA 408,JL. R. SYAMSUDIN SH NO. 50 SUK,SUKABUMI,43113,SKI-Z1PH01,SUKABUMI KOTA,100
2261,1,994751,SKI-AP. AWI,BLOK D2 PASAR SUKARAJA RT 02 R,SUKABUMI,43192,SKI-Z1PH01,SUKABUMI KOTA,100
2262,1,995467,SKI-RS. JAMPANG KULON (APBD),JL. CIBARUSA JAMPANGKULON NO.1,SUKABUMI,43178,SKI-Z2PH01,"PALABUHAN RATU, SURADE",101
2263,1,995471,SKI-TOSERBA HEMAT,JL. ARIAWIRATANUDATAR NO.21 RT,CIANJUR,,SKI-Z3CP01,"WARUNG KIARA,CITARIK,",301
2264,1,995778,PDG - SKI,Jl. Raya Bolang kaler RT 04/RW,,,SKI-Z4,SKI Z4,300
2265,1,995779,PDG - SKI,Jl. Raya Bolang kaler RT 04/RW,,,SKI,SUKABUMI,
2266,1,995835,SKI-KLINIK CALYSTA,JL. GUDANG NO.78 RT.01 RW.05 K,SUKABUMI,43113,SKI-Z1PH01,SUKABUMI KOTA,100
2267,1,995846,SKI-MM. SYIFA MART,JL. PADJAJARAN 1 RAMBAY SUKAMA,SUKABUMI,43152,SKI-Z1CP01,SUKABUMI KOTA,200
2268,1,995848,SKI-MM. B'MART,JL. PABUARAN STADION SURYAKENC,SUKABUMI,43135,SKI-Z1CP01,SUKABUMI KOTA,301
2269,1,998502,SKI-DR. MEILIANA,JL. RA. KOSASIH RUKO CISUDA RI,SUKABUMI,43192,SKI-Z1CP01,SUKABUMI KOTA,200
2270,1,999269,SKI-RM. IBU BUNUT,JL. RY. RUMAH SAKIT BUNUT 02 C,SUKABUMI,43113,SKI-Z1CP01,SUKABUMI KOTA,200
2271,1,999270,SKI-KLINIK ATALLAH,JL. PERUM VILLA MUTIARA LIDO 2,SUKABUMI,43359,SKI-Z3CP01,"WARUNG KIARA,CITARIK,",203
2272,1,999417,SKI-RSU SYAMSUDIN SH (APBD),JL. RUMAH SAKIT NO.1 RT.005/00,SUKABUMI,43111,SKI-Z1PH01,SUKABUMI KOTA,100
2273,1,999425,SKI-AP. KIMIA FARMA 505 CIPANAS,"JL. RAYA CIPANAS KM.83,1 CIPAN",CIANJUR,43253,SKI-Z3PH01,"CIANJUR KOTA, CIBEBER,",202
2274,1,999427,SKI-AP. KIMIA FARMA CIBEBER,JL. RAYA CIBEBER RT.01/RW.01 D,CIANJUR,43262,SKI-Z3PH01,"CIANJUR KOTA, CIBEBER,",202
2275,1,999533,SKI-AP. SEGER 2,JL. PROF. M. YAMIN NO.80 KEL.,CIANJUR,43213,SKI-Z3PH01,"CIANJUR KOTA, CIBEBER,",102
2276,1,999752,MKS - SKI,Jl. Raya Bolang kaler RT 04/RW,Sukabumi,,SKI,SUKABUMI,
2277,1,999903,SKI-INSTALASI GIZI RSUD. SAYANG,JL. RUMAH SAKIT NO. 1 CIANJUR,CIANJUR,43212,SKI-Z3PH01,"CIANJUR KOTA, CIBEBER,",102
2278,1,1000199,SKI-TK. MOLEK,JL. KP. HARUN KABIR NO.53 CIWA,SUKABUMI,43111,SKI-Z1CP01,SUKABUMI KOTA,200
2279,1,1001220,SKI-TK. SINAR MANDIRI,"KP. CITOE, KERTAJADI, CIDAUN.",CIANJUR,43275,SKI-Z3CP02,"CIANJUR SELATAN, SAGAR",203
2280,1,1001221,SKI-TK. SUMBER REZEKI,"JL. AGRABINTA, MEKARSARI, CIAN",CIANJUR,43273,SKI-Z3CP02,"CIANJUR SELATAN, SAGAR",203
2281,1,1001449,SKI-TK. HIKMAH BARU,PASAR CISAAT BLOK KF NO.41 SUK,SUKABUMI,43152,SKI-Z1CP01,SUKABUMI KOTA,200
2282,1,1001451,SKI-TK. SIMPATI,PASAR CISAAT BLOK KJ NO.15 SUK,SUKABUMI,43152,SKI-Z1CP01,SUKABUMI KOTA,200
2283,1,1001453,SKI-TK. AJENG,PASAR CISAAT BLOK KF NO.13 SUK,SUKABUMI,43152,SKI-Z1CP01,SUKABUMI KOTA,200
2284,1,1001681,SKI-TK. EMAN (LAKSANA),KP. PASAPEN RT.01 RW.06 BANTAR,SUKABUMI,43363,SKI-Z3CP01,"WARUNG KIARA,CITARIK,",202
2285,1,1001923,SKI-TK. BAPAK OMAN,JL. RY. CIKIDANG RT.01 RW.02,SUKABUMI,43367,SKI-Z3CP01,"WARUNG KIARA,CITARIK,",202
2286,1,1001925,SKI-TK. SEDERHANA,KP. SIMPANG RT.02/05 PS. PANGK,SUKABUMI,43367,SKI-Z3CP01,"WARUNG KIARA,CITARIK,",202
2287,1,1001972,SKI-AP. CIPANENGAH,JL. PELABUHAN II NO. 123 RT.02,SUKABUMI,43134,SKI-Z2PH01,"PALABUHAN RATU, SURADE",201
2288,1,1002067,SKI-PUSKESMAS WARUNGKIARA,JL. RAYA PELABUHAN II KM. 25 W,SUKABUMI,43362,SKI-Z3CP01,"WARUNG KIARA,CITARIK,",103
2289,1,1002068,SKI-PUSKESMAS CISAAT,JL. GELANGGANG PEMUDA CISAAT R,SUKABUMI,43152,SKI-Z1PH01,SUKABUMI KOTA,100
2290,1,1002485,SKI-TK. EDO,"JL. PEL RATU UBRUG, WARUNGKIAR",SUKABUMI,43362,SKI-Z3CP01,"WARUNG KIARA,CITARIK,",202
2291,1,1002493,SKI-PUSKESMAS SELAJAMBE,JL. SELAJAMBE NO.462 RT.034 RW,SUKABUMI,43152,SKI-Z1PH01,SUKABUMI KOTA,100
2292,1,1002500,SKI-PUSKESMAS DTP CIRANJANG,JL. RUMAH SAKIT NO.194 KEC. CI,CIANJUR,43282,SKI-Z3PH01,"CIANJUR KOTA, CIBEBER,",202
2293,1,1006061,SKI-TK. TANJUNG MUKTI,KP. SINDANGHAYU RT.002 RW.002,CIANJUR,43273,SKI-Z3CP02,"CIANJUR SELATAN, SAGAR",204
2294,1,1006531,SKI-PUSKESMAS KADUDAMPIT,JL. SITUGUNUNG KM.6 GEDEPANGRA,SUKABUMI,43153,SKI-Z1PH01,SUKABUMI KOTA,101
2295,1,1006536,SKI-KLINIK BSMI,"JL. PELABUHAN II KM.5,5 CIPANE",SUKABUMI,43134,SKI-Z2PH01,"PALABUHAN RATU, SURADE",102
2296,1,1006567,SKI-TK. H. ANDAR,KP. PUNCAK CEURI RT.015/RW.005,SUKABUMI,43181,SKI-Z3CP02,"CIANJUR SELATAN, SAGAR",203
2297,1,1006568,SKI-TK. SUGIH,KP. CIHERANG RT.001/RW.003 HEG,SUKABUMI,43181,SKI-Z3CP02,"CIANJUR SELATAN, SAGAR",203
2298,1,1006581,SKI-PUSKESMAS SUKASARI,JL. RAYA CIBEBER NO.09 KM.14 K,CIANJUR,43285,SKI-Z3PH01,"CIANJUR KOTA, CIBEBER,",302
2299,1,1006603,SKI-AP. KIMIA FARMA KARANG TENGA,JL. RAYA BANDUNG RT.003/012 KE,CIANJUR,43281,SKI-Z3PH01,"CIANJUR KOTA, CIBEBER,",201
2300,1,1006741,SKI-TK. MASLAHAT,JL. SAWAHLEGA RT.011 RW.03 PAL,SUKABUMI,43354,SKI-Z3CP01,"WARUNG KIARA,CITARIK,",202
2301,1,1007048,SKI-APOTEK TAMAN ASRI,JL. CIAUL PASIR KP. CIAUL KALE,SUKABUMI,43152,SKI-Z1PH01,SUKABUMI KOTA,100
2302,1,1008101,SKI-TK. FBR,JL. PASIRANGIN RT.02 RW.08 JAM,SUKABUMI,43171,SKI-Z3CP02,"CIANJUR SELATAN, SAGAR",203
2303,1,1008163,SKI-PUSKESMAS LIMBANGAN,JL. RAYA SUKABUMI - CIANJUR KM,SUKABUMI,43191,SKI-Z2PH01,"PALABUHAN RATU, SURADE",101
2304,1,1008167,SKI-PUSKESMAS SUKALARANG,JL. RAYA SUKALARANG KM. 11 SUK,SUKABUMI,43191,SKI-Z3PH01,"CIANJUR KOTA, CIBEBER,",103
2305,1,1009500,SKI-TK. JOFAN,KP. PENGKOLAN RT.06/02 PURABAY,SUKABUMI,43187,SKI-Z3CP01,"WARUNG KIARA,CITARIK,",203
2306,1,1009555,TGL - SKI,Jl. Raya Bolang kaler RT 04/RW,Sukabumi,,SKI,SUKABUMI,
2307,1,1009606,SKI-TK. AGUS,KP. CIMAPAG RT.14 RW.03 BANTAR,SUKABUMI,43171,SKI-Z3CP01,"WARUNG KIARA,CITARIK,",302
2308,1,1009611,SKI-PUSKESMAS PARUNGKUDA,JALAN SILIWANGI NO. 21 PARUNGK,SUKABUMI,43357,SKI-Z3PH01,"CIANJUR KOTA, CIBEBER,",102
2309,1,1009612,SKI-PUSKESMAS CICURUG,JALAN SILIWANGI NO. 113 RT 02,SUKABUMI,43359,SKI-Z3PH01,"CIANJUR KOTA, CIBEBER,",102
2310,1,1009850,SKI-TK. ARYA,BOJONG KOKOSAN RT.01 RW.07 PAR,SUKABUMI,43357,SKI-Z3CP01,"WARUNG KIARA,CITARIK,",301
2311,1,1010179,SKI-PUSKESMAS CIREUNGHAS,JL. RAYA SUKABUMI KM. 11 SUKAL,SUKABUMI,43191,SKI-Z2PH01,"PALABUHAN RATU, SURADE",302
2312,1,1010190,SKI-PUSKESMAS PURABAYA,JL. RAYA PURABAYA KM. 39 KP. M,SUKABUMI,43187,SKI-Z3PH01,"CIANJUR KOTA, CIBEBER,",302
2313,1,1010451,SKI-TK. H. AJUD,KP. CIBAREGBEG RT.01 RW.02 CIB,SUKABUMI,43181,SKI-Z3CP01,"WARUNG KIARA,CITARIK,",301
2314,1,1010452,SKI-TK. NENENG,KP. CIMANGGU RT. 04 RW.02 CIBA,SUKABUMI,43181,SKI-Z3CP01,"WARUNG KIARA,CITARIK,",301
2315,1,1010453,SKI-TK. BUNGSU,KP. MIRAMONTANA RT.018/002 NEG,SUKABUMI,43187,SKI-Z3CP01,"WARUNG KIARA,CITARIK,",301
2316,1,1010454,SKI-TK. SODAKALA,KP. CIHAUR RT.09/02 CURUGLUHUR,SUKABUMI,43181,SKI-Z3CP01,"WARUNG KIARA,CITARIK,",301
2317,1,1010455,SKI-TK. HJ. SOPIAH,KP. RANCABALI RT.01/02 KERTAAN,SUKABUMI,43196,SKI-Z3CP01,"WARUNG KIARA,CITARIK,",301
2318,1,1010457,SKI-TK. AIS,KP. NYALINDUNG RT.01/03 SUKABU,SUKABUMI,43196,SKI-Z3CP01,"WARUNG KIARA,CITARIK,",301
2319,1,1010458,SKI-TK. ADEN,KP. CIHAUR RT.09/02 CURUGLUHUR,SUKABUMI,43181,SKI-Z3CP01,"WARUNG KIARA,CITARIK,",301
2320,1,1010459,SKI-TK. RARA ANGKASA,KP. CIMANGGU HILIR RT.03/01 CU,SUKABUMI,43182,SKI-Z3CP01,"WARUNG KIARA,CITARIK,",301
2321,1,1010461,SKI-TK. LESTARI,KP. KARAJEUN II RT.03/01 CURUG,SUKABUMI,43181,SKI-Z3CP01,"WARUNG KIARA,CITARIK,",301
2322,1,1010462,SKI-TK. REFIQ,KP. CIBAREGBEG RT.01/02 CIBARE,SUKABUMI,43181,SKI-Z3CP01,"WARUNG KIARA,CITARIK,",301
2323,1,1010497,SKI-TK. IPAN,KP. KARAJEUN II RT.03/01 CURUG,SUKABUMI,43181,SKI-Z3CP01,"WARUNG KIARA,CITARIK,",301
2324,1,1010675,SKI-TK. BAROKAH,KP. GALUMPIT RT.20 RW.04 SUKAM,SUKABUMI,43175,SKI-Z3CP01,"WARUNG KIARA,CITARIK,",301
2325,1,1010752,SKI-PUSKESMAS CICANTAYAN,JK. KH. DAMANHURI KM.2 CICANTA,SUKABUMI,43155,SKI-Z2PH01,"PALABUHAN RATU, SURADE",201
2326,1,1010766,SKI-PUSKESMAS CARINGIN,JL. CARINGIN KM.3 CARINGINKULO,SUKABUMI,43154,SKI-Z2PH01,"PALABUHAN RATU, SURADE",201
2327,1,1010769,SKI-PUSKESMAS SIMPENAN,KP. CITAMIANG RT.002 RW.010 CI,SUKABUMI,43361,SKI-Z3PH01,"CIANJUR KOTA, CIBEBER,",301
2328,1,1011034,SKI-PUSKESMAS LENGKONG,JL. RAYA LENGKONG NO.20 RT.002,SUKABUMI,43174,SKI-Z2PH01,"PALABUHAN RATU, SURADE",301
2329,1,1011043,SKI-PUSKESMAS CAMPAKAMULYA,JL. WARUNGKADU KEC. CAMPAKAMUL,CIANJUR,43269,SKI-Z3PH01,"CIANJUR KOTA, CIBEBER,",301
2330,1,1011109,SKI-PUSKESMAS KARAWANG,JL. SELABINTANA KM.5 RT.06 RW.,SUKABUMI,43151,SKI-Z1PH01,SUKABUMI KOTA,101
2331,1,1011114,SKI-PUSKESMAS WARUNGKONDANG,JL. RAYA SUKABUMI NO.43  JAMBU,CIANJUR,43261,SKI-Z3PH01,"CIANJUR KOTA, CIBEBER,",301
2332,1,1011120,SKI-PUSKESMAS KEBONPEDES,JL. JAMBENENGGANG KEC. KEBONPE,SUKABUMI,43194,SKI-Z2PH01,"PALABUHAN RATU, SURADE",301
2333,1,1011124,SKI-PUSKESMAS SUKARAJA,LOJL. RAYA SUKARAJA KM. 5 NO.1,SUKABUMI,43192,SKI-Z1PH01,SUKABUMI KOTA,101
2334,1,1011127,SKI-PUSKESMAS KARANG TENGAH,JL. RAYA BANDUNG KM.4 RT.001 R,CIANJUR,43281,SKI-Z3PH01,"CIANJUR KOTA, CIBEBER,",301
2335,1,1011355,SKI-PUSKESMAS SINDANGBARANG,JL. RAYA SINDANGBARANG CIDAUN,CIANJUR,43272,SKI-Z3PH01,"CIANJUR KOTA, CIBEBER,",301
2336,1,1011835,SKI-WR. TEGUH,JL. NYALINDUNG GOALPARA RT.02,SUKABUMI,43192,SKI-Z1CP01,SUKABUMI KOTA,100
2337,1,1011837,SKI-WR. ZAKI,CIKARET RT.05 RW.01 SUKAMEKAR,SUKABUMI,43192,SKI-Z1CP01,SUKABUMI KOTA,0
