684,1,902735,SKI-TK. ALI HASAN,SUKABUMI DS.LEMBURSAWAH CICANT,SUKABUMI,43155,SKI-Z1CP01,SUKABUMI KOTA,200
685,1,902736,SKI-TK. SRIKANDI CIANJUR,"JL. CIJATI RT.7/6, CIJATI, CIA",CIANJUR,43284,SKI-Z3CP01,"WARUNG KIARA,CITARIK,",202
686,1,902737,SKI-TK. JAYA WIJAYA 2,PS. CICURUG BLOK C1 NO 48 LT 2,SUKABUMI,43359,SKI-Z3CP01,"WARUNG KIARA,CITARIK,",202
687,1,902739,SKI-TK. JODY,KP.PALAGAN JL.RAYA PARUNG KUDA,KAB. SUKABUMI,43357,SKI-Z3CP01,"WARUNG KIARA,CITARIK,",202
688,1,902740,SKI-TK. MATA HATI,JL.RAYA SILIWANGI NO.21 STATSI,SUKABUMI,43359,SKI-RXPD02,EXP DALAM KOTA SUKABUM,302
689,1,902749,SKI-TK. CAHAYA,"PS. CICURUG BLOK A NO.26, SUKA",SUKABUMI,43121,SKI-Z3CP01,"WARUNG KIARA,CITARIK,",202
690,1,902854,SKI-OBA MART,JL PELABUHAN II RT.002 RW.003,KAB. SUKABUMI,43157,SKI-Z2CP01,"CIKEMBAR,CIKEMBANG,CIB",201
691,1,902896,SKI-TK. SUKA SENANG,PS. DAYA BHAKTI PANGLESERAN BL,SUKABUMI,43161,SKI-Z3CP01,"WARUNG KIARA,CITARIK,",102
692,1,902954,SKI-TC. NURJIHAN,PERUM. BTN JAYARAKSA BLOK N NO,SUKABUMI,43161,SKI-Z1CP01,SUKABUMI KOTA,200
693,1,902956,SKI-TK. NURIL,JL. PASEKON 228 SUKARAJA SMI,KAB. SUKABUMI,43192,SKI-Z3CP01,"WARUNG KIARA,CITARIK,",203
694,1,902957,SKI-TC. DELLA,PASAR TERMINAL SUKARAJA BLOK A,SUKABUMI,43192,SKI-Z1CP01,SUKABUMI KOTA,200
695,1,902958,SKI-TC. EKA KOSMETIK,"PS. CICURUG BLOK G NO 89, KEL",SUKABUMI,43359,SKI-Z2CP01,"CIKEMBAR,CIKEMBANG,CIB",202
696,1,902960,SKI-TC. NIPA COSMETIC,PASAR CIBAREGBEG RT. 006/002 C,CIANJUR,43262,SKI-Z3CP01,"WARUNG KIARA,CITARIK,",206
697,1,902961,SKI-TC. KOMAR,PS. CIBAREGBEG - NANGGELENG BL,CIANJUR,43262,SKI-Z3CP01,"WARUNG KIARA,CITARIK,",206
698,1,903127,SKI-TO. AMAY,PS. DAYA BAKTI PANGLESERAN BLO,KAB. SUKABUMI,43157,SKI-Z3CP01,"WARUNG KIARA,CITARIK,",102
699,1,903342,SKI-TK. DD PUTRA,PS. CISAAT BLK A/5-6 SUKABUMI,SUKABUMI,43152,SKI-Z1CP01,SUKABUMI KOTA,200
700,1,903820,SKI-TC. MANDIRI,"PS. CIKALONG BLOK E NO.12-13,",CIANJUR,43291,SKI-Z3CP01,"WARUNG KIARA,CITARIK,",206
701,1,903973,SKI-AP. ABADI,JL. WARUNG KONDANG NO. 28 RT.,CIANJUR,43268,SKI-Z3PH01,"CIANJUR KOTA, CIBEBER,",102
702,1,904351,SKI-KARYAWAN EPM SUKABUMI,"JL. RY. CIBOLANG, CISAAT, SUKA",KAB. SUKABUMI,43152,SKI-Z1CP01,SUKABUMI KOTA,200
703,1,904487,SKI-PD. KALIBATA,PERUM CIGUNUNG INDAH BLOK A NO,SUKABUMI,43152,SKI-RXPD01,EXP DALAM KOTA SUKABUM,302
704,1,905005,SKI-BPS. INDAH HAPSARI FARDHANI,JL. GOTONG ROYONG NO.25 RT.005,SUKABUMI,43123,SKI-Z1PH01,SUKABUMI KOTA,100
705,1,905007,SKI-BPS. ARYA NURDIANI,"KP CIREUNGHAS RT.004 RW.002, B",SUKABUMI,43193,SKI-Z1PH01,SUKABUMI KOTA,100
706,1,905009,SKI-BPS. AI YAYAH KURNIA,"KP. LEBAKSIUH RT.019 RW.007, S",SUKABUMI,43153,SKI-Z1CP01,SUKABUMI KOTA,200
707,1,905016,SKI-RS. HERMINA (BAG. GIZI),RS. HERMINA (BAG. GIZI) JL. SU,SUKABUMI,43192,SKI-Z1PH01,SUKABUMI KOTA,100
708,1,905019,SKI-BPS. NIA SITI QUSTHONIA,KP. BABAKAN RT.04 RW.13 CIMAHI,SUKABUMI,43155,SKI-Z1CP01,SUKABUMI KOTA,200
709,1,905226,SKI-BPS. YULI IRMAWATI,PERUM GRIYA PERMATA TALAGA BLO,SUKABUMI,43154,SKI-Z1CP01,SUKABUMI KOTA,200
710,1,905230,SKI-BPS. RIKA LESTARI,JL KH DAMANHURI KP CANTAYAN RT,SUKABUMI,43155,SKI-Z1CP01,SUKABUMI KOTA,200
711,1,905231,SKI-BPS. RATNA SUMINAR,"KP CIPANAS RT.001 RW.005, CIKU",SUKABUMI,43168,SKI-Z1CP01,SUKABUMI KOTA,200
712,1,905338,SKI-BPS. SRI PURWANINGSIH,JL.RA. KOSASIH GG.KALIMANTAN R,SUKABUMI,43116,SKI-Z1CP01,SUKABUMI KOTA,200
713,1,905339,SKI-BPS. OOM HENDRINIO,KP. BABAKAN PASANTREN RT.02 RW,SUKABUMI,43365,SKI-Z3CP01,"WARUNG KIARA,CITARIK,",205
714,1,905340,SKI-BPS. YAYAH KHAERIAH,KP. CIMAHI GIRANG 022/004 CITA,SUKABUMI,43153,SKI-Z1CP01,SUKABUMI KOTA,201
715,1,905540,SKI-TK. 123,JL. CIRANJANG NO.123 RT.4 RW.5,CIANJUR,43282,SKI-Z3CP01,"WARUNG KIARA,CITARIK,",202
716,1,905541,SKI-TK. LS,JL. SUKABUMI KM.10 KP. CIPADAN,CIANJUR,43261,SKI-Z3CP01,"WARUNG KIARA,CITARIK,",202
717,1,906097,SKI-TK. GIRHAN,"KP. GANESA RT.1/3 CISOLOK, SUK",SUKABUMI,43366,SKI-Z3CP01,"WARUNG KIARA,CITARIK,",205
718,1,906102,SKI-KPRI MOTEKAR,JL. BAROS SUKABUMI,SUKABUMI,43161,SKI-Z1CP01,SUKABUMI KOTA,200
719,1,906235,SKI-TK. PUTRA JAYA,"KP. NAGRAK RT.2/4 CIKELAT, CIS",SUKABUMI,43366,SKI-Z2CP01,"CIKEMBAR,CIKEMBANG,CIB",201
720,1,906241,SKI-TK. DUA DARA,"PS. UBRUG, WARUNG KIARA, SUKAB",SUKABUMI,43362,SKI-Z2CP01,"CIKEMBAR,CIKEMBANG,CIB",201
721,1,906272,SKI-TK. WARNA,JL. LINGKAR SELATAN RT.3/6 JAY,SUKABUMI,43166,SKI-Z1CP01,SUKABUMI KOTA,200
722,1,906341,SKI-TC. NIZAM COSMETIC,"PS. CIPANAS BLOK C NO 22, KEL",CIANJUR,43253,SKI-Z3CP01,"WARUNG KIARA,CITARIK,",206
723,1,906527,SKI-BD. SETIA DARMAWATI,KP. CIKUKULU RT.14 RW.004 CISA,SUKABUMI,43155,SKI-Z1CP01,SUKABUMI KOTA,200
724,1,908191,SKI-TO. PURBA JAYA,JL. PASAR MODERN CISAAT (DPN Y,SUKABUMI,43152,SKI-Z1CP01,SUKABUMI KOTA,200
725,1,908558,SKI-TK. AMANAH,JL. PELABUHAN RATU DPN. DERMAG,SUKABUMI,43364,SKI-Z3CP01,"WARUNG KIARA,CITARIK,",205
726,1,908649,SKI-TK. AL BAROKAH,KP. CIGADOG RT.06 RW.02 KERTAJ,SUKABUMI,43361,SKI-Z3CP02,"CIANJUR SELATAN, SAGAR",203
727,1,908652,SKI-BD. INNE CHOIRINASYARI,PERUM GRAHA TMN SUKABUMI RT.01,SUKABUMI,43122,SKI-Z1CP01,SUKABUMI KOTA,200
728,1,908653,SKI-BPS. FITRI RINAWATI,KOMP. SECAPA POLRI BLOK B NO.0,SUKABUMI,43122,SKI-Z1CP01,SUKABUMI KOTA,200
729,1,908687,SKI-BPS. IMAS SITI SOPIAH AM. KE,CIBUNGUR RT.01 RW.02 LIMUSNUNG,SUKABUMI,43165,,,100
730,1,908714,SKI-TK. MARI JAYA,JL.CIAUL PASIR NO.44 RT.005 RW,SUKABUMI,43116,SKI-Z1CP01,SUKABUMI KOTA,200
731,1,908715,SKI-BD. TURINAH,JL. KARAMAT ANYAR NO.12 RT.01/,SUKABUMI,43122,SKI-Z1CP01,SUKABUMI KOTA,200
732,1,908719,SKI-BD. MARIA MAGDALENA HOTRI,PERUM TANJUNG SARI JL.CEMPAKA,SUKABUMI,43122,SKI-RXPD01,EXP DALAM KOTA SUKABUM,302
733,1,909274,SKI-TK. ABAH,JL. MUH. ALI KP. SUKASARI RT.2,CIANJUR,43282,SKI-Z3CP01,"WARUNG KIARA,CITARIK,",206
734,1,909877,SKI-C'MART CIMAJA,"JL. CIMAJA RT.4/1 CIMAJA, CIKA",KAB. SUKABUMI,43365,SKI-Z3CP01,"WARUNG KIARA,CITARIK,",202
735,1,909891,SKI-TK. RAKA,"KP. NAGRAK RT.3/4 CIKELAT, CIS",SUKABUMI,43366,SKI-Z2CP01,"CIKEMBAR,CIKEMBANG,CIB",201
736,1,909901,SKI-TO. DIAN FARMA,JL. SURYA KENCANA CIBADAK NO.1,KAB. SUKABUMI,43351,SKI-Z3CP01,"WARUNG KIARA,CITARIK,",202
737,1,910348,SKI-RB. BUNDA,"JL. IR. H. JUANDA NO.42, SELAK",CIANJUR,43211,SKI-Z3PH01,"CIANJUR KOTA, CIBEBER,",102
738,1,910360,SKI-BD. EUIS NURHAYATI,JL PROKLAMASI NO.18 RT.005 RW.,SUKABUMI,43122,SKI-Z1CP01,SUKABUMI KOTA,200
739,1,910596,SKI-BD. TIAH SAMSIAH,BABAKAN RT.04/003 SUKAKARYA WA,SUKABUMI,43135,SKI-Z1CP01,SUKABUMI KOTA,201
740,1,911081,SKI-TK. SINAR HERO,JL. LETTU BAKRI NO 61 SUKABUMI,SUKABUMI,43131,SKI-Z1CP01,SUKABUMI KOTA,200
741,1,911491,SKI-TOSERBA SUKAJADI,JL. RY. BANDUNG KM. 14 NO.40 C,CIANJUR,43282,SKI-Z3CP01,"WARUNG KIARA,CITARIK,",206
742,1,911547,SKI-TK. IBU RIDA,PS. CIKALONG PASAR BARU BLOK F,CIANJUR,43291,SKI-Z3CP01,"WARUNG KIARA,CITARIK,",206
743,1,911550,SKI-TK. SUNLY,JL. MOH. ALI NO.51 PERTIGAAN C,CIANJUR,43214,SKI-Z3CP01,"WARUNG KIARA,CITARIK,",206
744,1,912083,SKI-BD. IKA KARTIKA,"KP. TUGU RT 05/004 JAYARAKSA,",SUKABUMI,43161,SKI-Z1CP01,SUKABUMI KOTA,200
745,1,912110,SKI-TK. BINTANG JAYA,PS. KAUNG CIRANJANG (SAMPING T,CIANJUR,43282,SKI-Z3CP01,"WARUNG KIARA,CITARIK,",206
746,1,912114,SKI-TK. BINTANG MAS,JL. MOCH ALI NO.50 (SAMPING TK,CIANJUR,43214,SKI-Z3CP01,"WARUNG KIARA,CITARIK,",206
747,1,912357,SKI-TK. HEJO,JL. PS. PELITA ATAS (SAMPING T,SUKABUMI,43111,SKI-Z1CP01,SUKABUMI KOTA,200
748,1,912359,SKI-TK. BATU BARA ALI PALASARI,PARUNG KUDA SIMPANG JL. PALASA,SUKABUMI,43357,SKI-Z2CP01,"CIKEMBAR,CIKEMBANG,CIB",202
749,1,912360,SKI-TK. RAFA,JL. RY. CIMANGKOK RT.5/6 (SEBE,SUKABUMI,43191,SKI-Z3CP01,"WARUNG KIARA,CITARIK,",202
750,1,912361,SKI-TK. DZAKWAN,"PS. CISAAT BL.KA-13, JL. SURYA",SUKABUMI,43152,SKI-Z1CP01,SUKABUMI KOTA,200
751,1,912499,SKI-GIZI RS. KARTIKA SUKABUMI,JL. A. YANI NO.18 SUKABUMI,SUKABUMI,43111,SKI-Z1PH01,SUKABUMI KOTA,100
752,1,913384,SKI-TK. ADE LINA,KP. SIMPANG RT.2/10 WANGUN SAR,SUKABUMI,43366,SKI-Z3CP01,"WARUNG KIARA,CITARIK,",202
753,1,915570,SKI-BD. SITI HAMIDAH,"KP. KARAWANG CENTRAL, SUKABUMI",SUKABUMI,43151,SKI-Z1CP01,SUKABUMI KOTA,201
754,1,915571,SKI-TK. IBU EPON,PERUM TAMAN ASRI BLOK C2 NO. 8,SUKABUMI,43113,SKI-Z1CP01,SUKABUMI KOTA,200
755,1,915572,SKI-BD. HARTANTI,JL. KABANDUNGAN 001/006 SELABA,SUKABUMI,43114,SKI-Z1CP01,SUKABUMI KOTA,201
756,1,915621,SKI-NABILA GROSIR,JL. PELABUHAN II KM.7 NO.265 R,KAB. SUKABUMI,43169,SKI-Z1CP01,SUKABUMI KOTA,200
757,1,915895,SKI-TC. MULNI COS,PS. CIPANAS LT.1 BLOK C NO.6 C,CIANJUR,43253,SKI-Z3CP01,"WARUNG KIARA,CITARIK,",206
758,1,915897,SKI-TC. CHILLA ANIRA,PS. CINAPAS LT.2 BLOK A NO. 65,CIANJUR,43253,SKI-Z3CP01,"WARUNG KIARA,CITARIK,",206
759,1,916476,SKI-TK. DAFFA,JL. CIRANGKONG RT.13/12 SURADE,SUKABUMI,43179,SKI-Z3CP02,"CIANJUR SELATAN, SAGAR",210
760,1,916953,SKI-TK. H. UEP,"PS. CIPANAS BLOK A. NO.2, PACE",CIANJUR,43253,SKI-Z3CP01,"WARUNG KIARA,CITARIK,",206
761,1,916954,SKI-TK. YANI UTAY,PASAR SUKARAJA BLOK 1 NO. 37,SUKABUMI,43192,SKI-LKDCP03,"CIMANGKOK,CIBEBER,WARU",204
762,1,916973,SKI-KOP. ASSYIFA,JL. JENDRAL SUDIRMAN NO. 27 SU,SUKABUMI,43113,SKI-Z1CP01,SUKABUMI KOTA,200
763,1,917256,SKI-TC. SAMUDRA,JL. RAYA CISAAT SURYA KENCANA,SUKABUMI,43152,SKI-Z1CP01,SUKABUMI KOTA,200
764,1,917279,SKI-FASTNET,JL. CIBEUREUM GOALPARA KM 1 DK,SUKABUMI,43192,SKI-Z1CP01,SUKABUMI KOTA,200
765,1,917402,SKI-TC. OLINZIRA,KP. KEDUNG DESA TITISAN SUKALA,SUKABUMI,43191,SKI-Z3CP01,"WARUNG KIARA,CITARIK,",202
766,1,917409,SKI-TK. FITTO,"JL. RY. SUKALARANG KM.13, CIMA",KAB. SUKABUMI,43191,SKI-Z3CP01,"WARUNG KIARA,CITARIK,",202
767,1,917761,SKI-TC. SALMA COSMETIK,PSR. CISAAT KIOS BLOK KA1 NO.,SUKABUMI,43152,SKI-Z1CP01,SUKABUMI KOTA,200
768,1,917766,SKI-TK. ANNAS,PSR. CIKALONG BLOK F SUKAGALIH,CIANJUR,43291,SKI-Z3CP01,"WARUNG KIARA,CITARIK,",206
769,1,918183,SKI-TK. 3 PUTRI,JL. RY. CIBEBER SAMPING REL PI,CIANJUR,43262,SKI-Z3CP01,"WARUNG KIARA,CITARIK,",202
770,1,918190,SKI-TK. FARHAH,JL. MANGKU PRAJA KP. CIGEUNANG,CIANJUR,43212,SKI-Z3CP01,"WARUNG KIARA,CITARIK,",206
771,1,918194,SKI-TK. BURUNG NURI,"JL. RY. CIBEBER GELAR ANYAR, P",CIANJUR,43262,SKI-Z3CP01,"WARUNG KIARA,CITARIK,",206
772,1,918196,SKI-TK. A3,JL. RY. CIBEBER KP. NYALINDUNG,CIANJUR,43262,SKI-Z3CP01,"WARUNG KIARA,CITARIK,",206
773,1,918397,SKI-TK. MANFAAT,"JL. PS CURUG BLOK B, SUKABUMI",SUKABUMI,43359,SKI-RXLK02,EXP LUAR KOTA SUKABUMI,302
774,1,918451,SKI-TK. MANFAAT,PSR. CICURUG RUKO SAMPING TOKO,SUKABUMI,43359,SKI-Z2CP01,"CIKEMBAR,CIKEMBANG,CIB",202
775,1,918452,SKI-TC. MITRA 2,"PS. BARU CIBADAK KIOS D.036, C",SUKABUMI,43351,SKI-Z2CP01,"CIKEMBAR,CIKEMBANG,CIB",202
776,1,918711,SKI-TK. RANTI,"JL. CIKUKULU CARINGIN TALAGA,",SUKABUMI,43154,SKI-Z1CP01,SUKABUMI KOTA,200
777,1,918712,SKI-TK. FIRMANSYAH,JL. CARINGIN SEBERANG TK. BPK.,SUKABUMI,43154,SKI-Z1CP01,SUKABUMI KOTA,200
778,1,918716,SKI-TK. SEDAP SARI,JL. RY. SIMPAN CICANTAYAN KP.,SUKABUMI,43152,SKI-Z1CP01,SUKABUMI KOTA,200
779,1,918734,SKI-TK. RAYI RAKA,"JL. CARINGIN KP. TALAGA, CISAA",SUKABUMI,43154,SKI-Z1CP01,SUKABUMI KOTA,200
780,1,918737,SKI-TK. ADITYA ABANG FAISAL,"JL. CARINGIN KP. CIKUKULU, DS.",SUKABUMI,43154,SKI-Z1CP01,SUKABUMI KOTA,200
781,1,918740,SKI-TK. NASIB PUTRA,"JL. RY. CISAAT NO.204, ,CISAAT",SUKABUMI,43152,SKI-Z1CP01,SUKABUMI KOTA,200
782,1,918887,SKI-MM. MEDINA MART,JL. PELABUHAN 2 KM. 8 KP. TEGA,SUKABUMI,43169,SKI-Z1CP01,SUKABUMI KOTA,200
783,1,918890,SKI-TC. ERMA,PASAR PANGLESERAN SAMPING SALU,SUKABUMI,43156,SKI-Z1CP01,SUKABUMI KOTA,200
784,1,919002,SKI-TK. TIYANI,"JL. RY. CARINGIN NO.143, DPN S",SUKABUMI,43154,SKI-Z1CP01,SUKABUMI KOTA,200
785,1,919466,SKI-TK. OOK,JL. SUROSO NO.18 (SAMPING TK.,CIANJUR,43211,SKI-Z3CP01,"WARUNG KIARA,CITARIK,",206
786,1,919537,SKI-AP. MADINA,JL. PANGERAN HIDAYATULLOH NO.,CIANJUR,43212,SKI-Z3PH01,"CIANJUR KOTA, CIBEBER,",102
787,1,919628,SKI-BPS. MARYANTI UTAMI AMD. KEB,"GOTONG ROYONG SAUYUNAN, GN. PU",SUKABUMI,43123,SKI-Z1CP01,SUKABUMI KOTA,201
788,1,919630,SKI-BPS. EUIS SUSILAWATI,KP. BABAKAN BANDUNG RT.006/001,SUKABUMI,43116,SKI-Z1CP01,SUKABUMI KOTA,201
789,1,919743,SKI-TK. H. LIA,"JL. RY. SUKABUMI, PSR. WARUNG",CIANJUR,43261,SKI-Z3CP01,"WARUNG KIARA,CITARIK,",206
790,1,919812,SKI-TK. CAP NONA,PS. INDUK CIANJUR DKT. JATI AS,CIANJUR,43214,SKI-Z3CP01,"WARUNG KIARA,CITARIK,",206
791,1,919835,SKI-BPS. WURI ARIYANTI,KP. NYANGKOKOT 006/003 SALABIN,SUKABUMI,43151,SKI-Z1CP01,SUKABUMI KOTA,201
792,1,919836,SKI-BPS. LIA BARAH,"KP. CIPANCUK 019/004, CIBATU,",SUKABUMI,43152,SKI-Z1CP01,SUKABUMI KOTA,200
793,1,919838,SKI-BPS. YUSI KANIA FANRANI,"KP. BOJONG DUREN RT.003/002, P",SUKABUMI,43151,SKI-Z1CP01,SUKABUMI KOTA,201
794,1,920026,SKI-TC. BUNDA,PSR. CICURUG BLOK E1 NO.4 DPN,SUKABUMI,43359,SKI-Z2CP01,"CIKEMBAR,CIKEMBANG,CIB",202
795,1,920028,SKI-TC. INTAN COSMETIK,"PSR. CICURUG BLOK G NO.12, KP.",SUKABUMI,43359,SKI-Z2CP01,"CIKEMBAR,CIKEMBANG,CIB",202
796,1,920042,SKI-TC. YULIA YZ,PSR. CICURUG BLOK B NO.24 SEBE,SUKABUMI,43359,SKI-Z2CP01,"CIKEMBAR,CIKEMBANG,CIB",202
797,1,920129,SKI-TK. ASHARI DM,PSR. PELITA BLOK A3 NO.15 SBLH,SUKABUMI,43111,SKI-Z1CP01,SUKABUMI KOTA,200
798,1,920142,SKI-TO. RIZKY,"PSR PELITA BLOK K1 NO. 8, SAMP",SUKABUMI,43111,SKI-Z1CP01,SUKABUMI KOTA,200
799,1,920147,SKI-TK. MITRA,JALAN PASAR NO.122 DPN TK. MAI,SUKABUMI,43111,SKI-Z1CP01,SUKABUMI KOTA,200
800,1,920155,SKI-TK. TIGA,PASAR CIWANGI RT.003 RW.006 NY,SUKABUMI,43131,SKI-Z1CP01,SUKABUMI KOTA,200
801,1,920161,SKI-TK. RUDI ASHARI,PASAR PELITA JAJARAN STASIUN B,SUKABUMI,43111,SKI-Z1CP01,SUKABUMI KOTA,200
802,1,920168,SKI-TC. CANTIKA,PSR PELITA JL. GG. ARAB LANTAI,SUKABUMI,43111,SKI-Z1CP01,SUKABUMI KOTA,200
803,1,920270,SKI-TO. RIAMIN 3,"JL. PELABUHAN 2 KM.15, BOJONG,",SUKABUMI,43157,SKI-Z3CP01,"WARUNG KIARA,CITARIK,",202
804,1,920281,SKI-TO. ALYSSA FARMA,JL. RAYA SKBMI KM.12 CIMANGKOK,KAB. SUKABUMI,43191,SKI-Z3CP01,"WARUNG KIARA,CITARIK,",202
805,1,920284,SKI-TK. SYAWAL,"JL. SUKALARANG CIMANGKOK, SBLM",KAB. SUKABUMI,43191,SKI-Z3CP01,"WARUNG KIARA,CITARIK,",202
806,1,920290,SKI-TK. SYAMI PUTRA,"JL. RY. SKBMI, KP. BAROS, PABR",KAB. SUKABUMI,43191,SKI-Z3CP01,"WARUNG KIARA,CITARIK,",202
807,1,920299,SKI-TK. DIK DIK,JL. RY. SKBMI SAMPING FITTO KP,KAB. SUKABUMI,43191,SKI-Z3CP01,"WARUNG KIARA,CITARIK,",202
808,1,920300,SKI-TK. MALIO,JL. RY. CIMANGKOK DPN. OLINZIR,SUKABUMI,43191,SKI-Z3CP01,"WARUNG KIARA,CITARIK,",202
809,1,920549,SKI-TK. TORANG,"JL. RY. CISOLOK CITEPUS, PL. R",SUKABUMI,43364,SKI-Z3CP01,"WARUNG KIARA,CITARIK,",202
810,1,920554,SKI-TK. CANTIK,JL. BARU PELABUHAN RATU PEREMP,SUKABUMI,43364,SKI-Z3CP01,"WARUNG KIARA,CITARIK,",205
811,1,920555,SKI-TK. ADE ABDUL 2,JL. RY. CISOLOK NO.1 PS. CISOL,SUKABUMI,43366,SKI-Z3CP01,"WARUNG KIARA,CITARIK,",205
812,1,920556,SKI-TK. ALUN JAYA,"JL. PL. RATU PS. CISOLOK , SUK",SUKABUMI,43366,SKI-Z3CP01,"WARUNG KIARA,CITARIK,",205
813,1,920557,SKI-TK. BAH BOTAK,"JL. PELABUHAN RAYA, WARUNG TIA",SUKABUMI,43364,SKI-Z3CP01,"WARUNG KIARA,CITARIK,",205
814,1,920558,SKI-TK. LUTFI,"PS. PELABUHAN RATU, KAB. SUKAB",SUKABUMI,43364,SKI-Z3CP01,"WARUNG KIARA,CITARIK,",205
815,1,920813,SKI-TK. HJ. IHAT,"PS. TERMINAL NO. 14-15, CIPANA",CIANJUR,43253,SKI-Z3CP01,"WARUNG KIARA,CITARIK,",206
816,1,920815,SKI-TK. HJ. MAMAN,"PS. CIPANAS BLOK C NO.170, DAR",CIANJUR,43253,SKI-Z3CP01,"WARUNG KIARA,CITARIK,",206
817,1,920826,SKI-TO. PELITA,JL. STASIUN BARAT PS. PELITA B,SUKABUMI,43111,SKI-Z1CP01,SUKABUMI KOTA,200
818,1,920835,SKI-TK. TIMUR RAYA,JL. LETTU SOBRI BELPAS/ODEON K,SUKABUMI,43111,SKI-Z1CP01,SUKABUMI KOTA,200
819,1,920841,SKI-TO. SEHAT 8,"PS. PELITA, JL. STASIUN TIMUR",SUKABUMI,43111,SKI-Z1CP01,SUKABUMI KOTA,200
820,1,920843,SKI-TK. MUGOTS BAROKAH,JL. STASIUN TIMUR NO.28 (CAT K,SUKABUMI,43111,SKI-Z1CP01,SUKABUMI KOTA,200
821,1,920846,SKI-TK. AA. SUGANDA,"PS. RAHAYU BLOK W 8 NO.54, CIP",CIANJUR,43253,SKI-Z3CP01,"WARUNG KIARA,CITARIK,",206
822,1,920849,SKI-TK. MEKAR WANGI,PS. CIPANAS BLOK C LANTAI 1 NO,CIANJUR,43253,SKI-Z3CP01,"WARUNG KIARA,CITARIK,",206
823,1,921099,SKI-TK. AKONG,JL. PASAR PELITA LAMA NO.79 KE,SUKABUMI,43111,SKI-Z1CP01,SUKABUMI KOTA,200
824,1,921143,SKI-TK. KEMBAR PUTRA,JL. BERSIH TANJUNG RT.01/02 TA,CIANJUR,43211,SKI-RXLK02,EXP LUAR KOTA SUKABUMI,302
825,1,921149,SKI-TO. ARYA MEDICA,"JL. SILIWANGI NO.9, CIKALONG K",CIANJUR,43291,SKI-Z3CP01,"WARUNG KIARA,CITARIK,",202
826,1,921156,SKI-TK. RAFFA UTAMA,JL. ARWINDA KP. BAROS NO.3 SUK,CIANJUR,43281,SKI-Z3CP02,"CIANJUR SELATAN, SAGAR",210
827,1,921161,SKI-TK. PRIBUMI,JL. ARWINDA PEREMPATAN GUNTENG,CIANJUR,43281,SKI-Z3CP02,"CIANJUR SELATAN, SAGAR",210
828,1,921301,SKI-TK. SINAR BAHAGIA,KP. SADANG BANTAR KUNING CARIU,CIANJUR,43211,SKI-RXLK01,EXP LUAR KOTA CIANJUR,302
829,1,921319,SKI-TK. MIMIN,PS. CARIU BLOK D NO.13 KEL. CA,CIANJUR,43211,SKI-RXLK01,EXP LUAR KOTA CIANJUR,302
830,1,921320,SKI-TK. TANIZAR,PS. CARIU BLOK E.19 KEL. CARIU,CIANJUR,43211,SKI-RXLK01,EXP LUAR KOTA CIANJUR,302
831,1,921322,SKI-TK. ANTON,"PS. CARIU BLOK A NO.1 , CARIU",CIANJUR,43211,SKI-RXLK01,EXP LUAR KOTA CIANJUR,302
832,1,921325,SKI-TK. H. UDIN,PS. CARIU BLOK F.7 CARIU,CIANJUR,43211,SKI-RXLK01,EXP LUAR KOTA CIANJUR,301
833,1,921329,SKI-TK. RIVAN DICO,"P. CARIU, BLOK C-6, NO. 9-10,",CIANJUR,43211,SKI-RXLK01,EXP LUAR KOTA CIANJUR,301
834,1,921330,SKI-TK. ADE MAKMUR,PSR. CARIU BLOK C NO.12 KEL. C,CIANJUR,43211,SKI-RXLK01,EXP LUAR KOTA CIANJUR,301
835,1,921335,SKI-TK. LIA (CARIU),JL. RAYA BRIGJEN DARSONO RT.03,CIANJUR,43211,SKI-RXLK01,EXP LUAR KOTA CIANJUR,301
836,1,921337,SKI-TK. SEDERHANA,JL.BRIGJEND DARSONO 38 CARIU,CIANJUR,43211,SKI-RXLK01,EXP LUAR KOTA CIANJUR,301
837,1,921899,SKI-AP. NURANI,JL. SILIWANGI NO. 72 RT. 04/08,SUKABUMI,43351,SKI-RXLK03,EXP LUAR KOTA SUKABUMI,302
838,1,922045,SKI-PD. HARAPAN,PS. CIPANAS BASEMENT BLOK B NO,CIANJUR,43253,SKI-Z3CP01,"WARUNG KIARA,CITARIK,",202
839,1,922636,SKI-PENJUALAN TUNAI CHB,JL. RY. CIBOLANG KALER RT.04 R,SUKABUMI,43152,SKI,SUKABUMI,302
840,1,922641,SKI-RS. JAMPANG KULON,JL. RAYA CIBARUSA JAMPANGKULON,SUKABUMI,43178,SKI-RXLK03,EXP LUAR KOTA SUKABUMI,302
841,1,922642,SKI-INST FARM RSU. SEKARWANGI,JL. SILIWANGI 49 CIBADAK SMI,SUKABUMI,43351,SKI-RXLK03,EXP LUAR KOTA SUKABUMI,302
842,1,922643,SKI-AP. TIARA FARMA,JL. SURYAKENCANA NO.17 KP. PAM,SUKABUMI,43356,SKI-RXLK02,EXP LUAR KOTA SUKABUMI,302
843,1,922711,SKI-AP. MEDIKA FARMA,JL. CAGAK CIBARAJA RT.01/01 DE,KAB. SUKABUMI,43152,SKI-Z1PH01,SUKABUMI KOTA,100
844,1,922712,SKI-ADE HERMAWAN,KP.RAWA BENING RT 06/04 CIDADA,SUKABUMI,43183,SKI-Z2PH01,"PALABUHAN RATU, SURADE",103
845,1,922713,"SKI-ALUYSIUS,BAPAK",JL. KRAKATAU RAYA B.3/6 RT.001,SUKABUMI,43165,,,100
846,1,922714,SKI-AP. 24 JAM (RSU. CIMACAN),JL. RAYA CIMACAN N0.17 CIANJUR,CIANJUR,43253,SKI-Z3PH01,"CIANJUR KOTA, CIBEBER,",105
847,1,922715,SKI-AP. AHMAD YANI,JL. A.YANI NO.4 SUKABUMI,SUKABUMI,43111,SKI-Z1PH01,SUKABUMI KOTA,100
848,1,922716,SKI-AP. AKMAL,JL. PANGLAYUNGAN NO.27 CIANJUR,CIANJUR,43252,SKI-Z3PH01,"CIANJUR KOTA, CIBEBER,",102
849,1,922717,SKI-AP. ALAMI,JL. SURYAKENCANA NO.80 RT 15/0,KAB. SUKABUMI,43152,SKI-Z1PH01,SUKABUMI KOTA,100
850,1,922718,SKI-AP. ASRI FARMA,JL. OTTO ISKANDARDINATA 1 NO.,CIANJUR,43212,SKI-Z3PH01,"CIANJUR KOTA, CIBEBER,",102
851,1,922719,SKI-AP. BALDES,JL. BALAI DESA NO.4 CIKOTE SMI,SUKABUMI,43113,SKI-Z1PH01,SUKABUMI KOTA,100
852,1,922720,SKI-AP. BERKAH FARMA,"JL. RUMAH SAKIT 9A , BOJONG HE",CIANJUR,43211,SKI-Z3PH01,"CIANJUR KOTA, CIBEBER,",102
853,1,922721,SKI-AP. BINTANG,JL. OTISTA NO.114 KEC. CITAMIA,SUKABUMI,43112,SKI-Z1PH01,SUKABUMI KOTA,100
854,1,922722,SKI-AP. BUNUT,JL. RUMAH SAKIT NO. 2 CIKOLE S,SUKABUMI,43113,SKI-Z1PH01,SUKABUMI KOTA,100
855,1,922723,SKI-PT. GRIYA NUTRISI,"JL. SAMPURNA NO. 5, KEL. PASTE",BANDUNG,40161,SKI-RXLK01,EXP LUAR KOTA CIANJUR,301
856,1,922724,SKI-AP. CIMAYA,JL. SITI JENAB NO.71 RT 003 RW,CIANJUR,43211,SKI-Z3PH01,"CIANJUR KOTA, CIBEBER,",102
857,1,922725,SKI-AP. DUTA FARMA,JL. SILIWANGI NO. 21 PELABUHAN,KAB. SUKABUMI,43364,SKI-Z3PH01,"CIANJUR KOTA, CIBEBER,",103
858,1,922764,SKI-RSUD PELABUHAN RATU,JALAN JENDRAL A. YANI NO. 2 KE,KAB. SUKABUMI,43364,SKI-Z2PH01,"PALABUHAN RATU, SURADE",101
859,1,922771,SKI-RSU.SAMSUDIN (RIK.SERUNI),JL. RUMAH SAKIT NO.1 SUKABUMI,SUKABUMI,43113,SKI-Z1PH01,SUKABUMI KOTA,100
860,1,922773,SKI-RSU. CIANJUR,JL. RUMAH SAKIT NO. 1 CIANJUR,CIANJUR,43212,SKI-Z3PH01,"CIANJUR KOTA, CIBEBER,",102
861,1,922811,SKI-AP. ENGGAL WARAS,JL.MOCH ALI NO.30 KAB.CIANJUR,CIANJUR,43214,SKI-Z3PH01,"CIANJUR KOTA, CIBEBER,",102
862,1,922813,SKI-AP. FIK FARMA,PS.TERMINAL SUKARAJA BLOK.A NO,KAB. SUKABUMI,43192,,,100
863,1,922816,SKI-AP. H24,JL. RAYA KARANGTENGAH NO.504 K,KAB. SUKABUMI,43351,SKI-Z2PH01,"PALABUHAN RATU, SURADE",101
864,1,922819,SKI-AP. HARAPAN SEHAT,JL. RAYA CILAKU CIBEBER KM.10,CIANJUR,43285,SKI-Z3PH01,"CIANJUR KOTA, CIBEBER,",102
865,1,922822,SKI-AP. HARUM,KOMPLEK RUMAH SAKIT SEKARWANGI,SUKABUMI,43351,SKI-Z2PH01,"PALABUHAN RATU, SURADE",102
866,1,922824,SKI-AP. HASANAH,JL. DR. MUWARDI NO. 134 CJR,CIANJUR,43216,SKI-Z3PH01,"CIANJUR KOTA, CIBEBER,",104
867,1,922825,SKI-AP. HUSADA MANDIRI,JL. RUMAH SAKIT NO.2 PL. RATU,SUKABUMI,43364,SKI-Z2PH01,"PALABUHAN RATU, SURADE",103
868,1,922840,SKI-AP. JALUR FARMA,JL. PELABUHAN II NO.463 RT04/0,KAB. SUKABUMI,43167,SKI-Z1PH01,SUKABUMI KOTA,100
869,1,922841,SKI-AP. K-24 SILIWANGI,JL. RAYA SILIWANGI NO. 66 RT.,KAB. SUKABUMI,43357,SKI-Z2PH01,"PALABUHAN RATU, SURADE",102
870,1,922842,SKI-AP. KIMIA FARMA 317 ( CIANJU,JL. MUWARDI NO. 150 E CIANJUR,CIANJUR,43216,SKI-Z3PH01,"CIANJUR KOTA, CIBEBER,",104
871,1,922843,SKI-AP. KIMIA FARMA 351,JL. SILIWANGI NO 70 CIBADAK SU,SUKABUMI,43351,SKI-Z2PH01,"PALABUHAN RATU, SURADE",102
872,1,922845,SKI-AP. KIMIA FARMA 408,JL. R. SYAMSUDIN SH NO. 50 KOT,SUKABUMI,43112,SKI-Z1PH01,SUKABUMI KOTA,100
873,1,922846,SKI-AP. KOPERASI IKATAN DOKTER I,JL RAYA KARANGTENGAH KP PASAR,KAB. SUKABUMI,43351,SKI-Z2PH01,"PALABUHAN RATU, SURADE",102
874,1,922847,SKI-AP. LULU FARMA,JL. H. LOMRI NO.14 RT.02/RW.02,CIANJUR,43291,SKI-Z3PH01,"CIANJUR KOTA, CIBEBER,",104
875,1,922848,SKI-AP. MAKMUR,JL. RAYA CIPANAS NO.177 CJR,CIANJUR,43253,SKI-Z3PH01,"CIANJUR KOTA, CIBEBER,",102
876,1,922849,SKI-AP. MAXI,JL.JEN SUDIRMAN NO.73 SUKABUMI,SUKABUMI,43112,SKI-Z1PH01,SUKABUMI KOTA,100
877,1,922850,SKI-AP. MEGA FARMA,JL. PAJAGALAN KOMP. DANALAGA A,SUKABUMI,43135,SKI-Z1PH01,SUKABUMI KOTA,100
878,1,922851,SKI-AP. MIRAH,JL. AHMAD YANI PALABUHAN RATU,KAB. SUKABUMI,43111,SKI-Z2PH01,"PALABUHAN RATU, SURADE",101
879,1,922852,SKI-AP. PHARMACIA,JL SILIWANGI NO.121 KP KAUM KI,KAB. SUKABUMI,43359,SKI-Z3PH01,"CIANJUR KOTA, CIBEBER,",102
880,1,922853,SKI-AP. PRADHITA,JL. RUMAH SAKIT NO.6A RT.003 R,SUKABUMI,43113,SKI-Z1PH01,SUKABUMI KOTA,100
881,1,922854,SKI-AP. RAJAWALI MEDIKA,JL. RUMAH SAKIT NO. 9 CIANJUR,CIANJUR,43215,SKI-Z3PH01,"CIANJUR KOTA, CIBEBER,",102
882,1,922855,SKI-AP. RAJAWALI,JL. RA KOSASIH KOMPLEK RUKO CI,SUKABUMI,43121,SKI-Z2PH01,"PALABUHAN RATU, SURADE",101
883,1,922856,SKI-AP. RAMBAY,JL. RAMBAY NO.26 - SUKABUMI,KAB. SUKABUMI,43152,SKI-Z1PH01,SUKABUMI KOTA,100
884,1,922857,SKI-AP. RIYADH FARMA,JL. PASIR GEDE RAYA NO. 7 CIAN,CIANJUR,43216,SKI-Z3PH01,"CIANJUR KOTA, CIBEBER,",102
885,1,922858,SKI-AP. SADEWATA,JL. RAYA BANDUNG NO. 124 RT. 0,CIANJUR,43281,SKI-Z3PH01,"CIANJUR KOTA, CIBEBER,",102
886,1,922859,SKI-AP.SEHAT-I,JL.ARIA WIRATANUDATAR NO.223C,CIANJUR,43281,SKI-Z3PH01,"CIANJUR KOTA, CIBEBER,",102
887,1,922860,SKI-AP. SEKAR WANGI,JL.SILIWANGI NO.68 CIBADAK SMI,KAB. SUKABUMI,43351,SKI-Z2PH01,"PALABUHAN RATU, SURADE",101
888,1,922861,SKI-AP. SITU FARMA,"JL.PELABUHAN II KM 6 SUKABUMI,",SUKABUMI,43135,SKI-Z2PH01,"PALABUHAN RATU, SURADE",101
889,1,922862,SKI-AP. SUMBER WANGI,"JL. PASAR PELITA BLOK K-3, CIK",SUKABUMI,43111,SKI-Z1PH01,SUKABUMI KOTA,100
890,1,922863,SKI-AP. TIARA FARMA,JL. SURYAKENCANA NO. 17 CIBADA,KAB. SUKABUMI,43351,SKI-Z2PH01,"PALABUHAN RATU, SURADE",102
891,1,922864,SKI-AP. WAHYU,JL. P HIDAYATULLAH NO.14 CNJR,CIANJUR,43253,SKI-Z3PH01,"CIANJUR KOTA, CIBEBER,",104
892,1,922865,SKI-BP. GALIH PERKASA,PERUMAHAN TAMAN SARI PELABUHAN,SUKABUMI,43111,SKI-RXPD01,EXP DALAM KOTA SUKABUM,302
893,1,922866,SKI-CHUSNUL AWAQIB,JL. KALASAN RAYA NO K-54 (LAB,SUKABUMI,43113,,,100
894,1,922867,SKI-DINAS KESEHATAN KAB. CIANJUR,"JL. PROF M. YAMIN NO.58, SAYAN",CIANJUR,43214,SKI-Z3PH01,"CIANJUR KOTA, CIBEBER,",102
895,1,922868,SKI-DINAS KESEHATAN KOTA SUKABUM,JL. SURYAKENCANA NO.45 RT.01/0,SUKABUMI,43111,SKI-RXPD01,EXP DALAM KOTA SUKABUM,302
896,1,922869,SKI-INST FARM RSU. SEKARWANGI,JL. SILIWANGI NO.49 RT.002/RW.,KAB. SUKABUMI,43351,SKI-Z3PH01,"CIANJUR KOTA, CIBEBER,",102
897,1,922870,SKI-KLINIK PERMATA,"JL. RA KOSASIH RT01/16,CISARUA",SUKABUMI,43111,SKI-Z1PH01,SUKABUMI KOTA,100
898,1,922871,SKI-LAB. KLINIK VITA MEDIKA,JL. SURYAKENCANA NO.4 GUNUNGPA,SUKABUMI,43111,SKI-Z1PH01,SUKABUMI KOTA,100
899,1,922894,SKI-NY. YOHANA TANTRI,JL. MANGUN SARKORO RT. 01/04 N,CIANJUR,43214,SKI-Z3PH01,"CIANJUR KOTA, CIBEBER,",104
900,1,922919,SKI-AP. 24 JAM (RSU CIMACAN),JL. RAYA CIMACAN NO 17 CIANJUR,CIANJUR,43253,SKI-Z3PH01,"CIANJUR KOTA, CIBEBER,",102
901,1,922920,SKI-RS. R. SYAMSUDIN S.H,JL.RUMAH SAKIT NO.01 RT 005/00,SUKABUMI,43111,SKI-Z1PH01,SUKABUMI KOTA,100
902,1,922921,SKI-OMAN HERMAN,KP.KARET JAJAR RT.18 RW.05 PAS,SUKABUMI,43179,SKI-RXLK02,EXP LUAR KOTA SUKABUMI,302
903,1,922924,SKI-PT. INDOLAKTO,"JL. RAYA SILIWANGI, PASAWAHAN,",SUKABUMI,43359,SKI-Z2PH01,"PALABUHAN RATU, SURADE",102
904,1,922929,SKI-RS. BERSALIN BAHAGIA,JL. PASUNDAN NO.93 RT.04 RW.04,SUKABUMI,43131,SKI-Z1PH01,SUKABUMI KOTA,100
905,1,922935,SKI-RS. JAMPANGKULON,JL. CIBARUSA JAMPANGKULON NO.1,KAB. SUKABUMI,43178,SKI-Z2PH01,"PALABUHAN RATU, SURADE",101
906,1,922937,SKI-RS. KARTIKA MEDICAL CENTER C,"JL. SILIWANGI NO. 139, KEL. CI",KAB. SUKABUMI,43351,SKI-Z3PH01,"CIANJUR KOTA, CIBEBER,",102
907,1,922951,SKI-RS. BHAYANGKARA,JL. AMINTA AZMALI NO. 59A RT.0,SUKABUMI,43121,SKI-Z1PH01,SUKABUMI KOTA,100
908,1,922982,SKI-TK. 25,JL. AHMAD YANI NO.25 SUKABUMI,SUKABUMI,43111,SKI-Z1CP01,SUKABUMI KOTA,200
909,1,922983,SKI-TK. 305,JL. A YANI NO.305 SMI,SUKABUMI,43111,SKI-Z1CP01,SUKABUMI KOTA,200
910,1,922984,SKI-TK. AA,DS.MUKA RUKO BARU - CIANJUR,CIANJUR,43213,SKI-Z3CP01,"WARUNG KIARA,CITARIK,",202
911,1,922986,SKI-TK. AEP,JL. PELTU PASIR SUREN,KAB. SUKABUMI,43364,SKI-Z3CP01,"WARUNG KIARA,CITARIK,",202
912,1,922988,SKI-TK. AGUS,JL. JULIUS USMAN CITAMIANG SMI,SUKABUMI,43131,SKI-Z1CP01,SUKABUMI KOTA,200
