1399,1,936956,SKI-WR. PAK DIDIN,JL. CIANDOM RT.1/7 CIBEUREUM H,SUKABUMI,43165,SKI-Z1CP01,SUKABUMI KOTA,200
1400,1,936957,SKI-WR. CANDRA,JL. BENTENG NO.8 WARUDOYONG RT,SUKABUMI,43132,SKI-Z1CP01,SUKABUMI KOTA,200
1401,1,936958,SKI-WR. ROSE,JL. MUHTAR OBING NO.9 RT.2/3 W,SUKABUMI,43132,SKI-Z1CP01,SUKABUMI KOTA,200
1402,1,936959,SKI-TK. DANI,"JL. PEMBANGUNAN RT.2/5 , BABAK",SUKABUMI,43165,SKI-Z1CP01,SUKABUMI KOTA,200
1403,1,936961,SKI-TK. EPON I,PERUM TAMAN ASRI B.4 NO.1 SUBA,SUKABUMI,43116,SKI-Z1CP01,SUKABUMI KOTA,200
1404,1,936962,SKI-TK. EPON II,JL. PERUM TAMAN ASRI C2. NO.8,SUKABUMI,43116,SKI-Z1CP01,SUKABUMI KOTA,200
1405,1,936963,SKI-WR. BUNDA RIFI,PERUM KONDORA BLOK C4 NO.29 SU,SUKABUMI,43116,SKI-Z1CP01,SUKABUMI KOTA,200
1406,1,936964,SKI-WR. BUNDA ADE,PERUM KONDORA BLOK C5 NO.35 SU,SUKABUMI,43116,SKI-Z1CP01,SUKABUMI KOTA,200
1407,1,936965,SKI-WR. PAK RIKI,PERUM KANDARA BLOK A1 NO.29 SU,SUKABUMI,43116,SKI-Z1CP01,SUKABUMI KOTA,200
1408,1,936966,SKI-WR. IBU AI,JL. SUBANGJAYA KULON RT.5/6 CI,SUKABUMI,43116,SKI-Z1CP01,SUKABUMI KOTA,200
1409,1,936968,SKI-WR. IBU EHA,JL. SUBANGJAYA NO.4 RT.2/5 CIK,SUKABUMI,43116,SKI-Z1CP01,SUKABUMI KOTA,200
1410,1,936969,SKI-WR. RAMDAN,JL. SUBANGJAYA RT.4/5 CIKOLE,SUKABUMI,43116,SKI-Z1CP01,SUKABUMI KOTA,200
1411,1,936970,SKI-WR. IBU ETI,SUBANGJAYA NO.50 RT.1/4 CIKOLE,SUKABUMI,43116,SKI-Z1CP01,SUKABUMI KOTA,200
1412,1,936971,SKI-TK. DAISADI,JL. SUBANGJAYA NO.23 RT.1/4 CI,SUKABUMI,43116,SKI-Z1CP01,SUKABUMI KOTA,200
1413,1,936972,SKI-WR. PAK DIDIN,JL. SRIWEDARI NO.120 RT.5/2 GN,SUKABUMI,43121,SKI-Z1CP01,SUKABUMI KOTA,200
1414,1,936973,SKI-WR. SUKARSIH,JL. SRIWEDARI NO/72 RT.3/2 GN.,SUKABUMI,43121,SKI-Z1CP01,SUKABUMI KOTA,200
1415,1,936974,SKI-TK. LUBIS,"JL. SUBANGJAYA RT.2/6 CIAUL, C",SUKABUMI,43116,SKI-Z1CP01,SUKABUMI KOTA,200
1416,1,936977,SKI-WR. YULIA,TAMAN ASRI BLOK B6 NO.21 CIAUL,SUKABUMI,43113,SKI-Z1CP01,SUKABUMI KOTA,200
1417,1,936979,SKI-WR. IBU LINA,TAMAN SARI BLOK C3 NO.12 CIAUL,SUKABUMI,43113,SKI-Z1CP01,SUKABUMI KOTA,200
1418,1,937287,SKI-TK. SULTON,JL. VETERAN NO.19 RT. 11/04 MA,SUKABUMI,43156,SKI-Z1CP01,SUKABUMI KOTA,200
1419,1,937289,SKI-WR. H. DIAN,JL. VETERAN NO.88 RT.19/05 MAN,SUKABUMI,43156,SKI-Z1CP01,SUKABUMI KOTA,200
1420,1,937291,SKI-WR. OBAD,JL. VETERAN MANGKALAYA GN. GUR,SUKABUMI,43156,SKI-Z1CP01,SUKABUMI KOTA,200
1421,1,937293,SKI-WR. BPK. YUDI,JL. VETERAN MANGKALAYA GN. GUR,SUKABUMI,43156,SKI-Z1CP01,SUKABUMI KOTA,200
1422,1,937294,SKI-TK. ELSA,JL. VETERAN  RT.25/7 MANGKALAY,SUKABUMI,43156,SKI-Z1CP01,SUKABUMI KOTA,200
1423,1,937296,SKI-TK. ENENG SITI,KP. SAWUNG LEGA 194 RT.27/8 MA,SUKABUMI,43156,SKI-Z1CP01,SUKABUMI KOTA,200
1424,1,937298,SKI-TK. DECIL,PERUM GRIYA PERMATA PERMAI 2 N,SUKABUMI,43156,SKI-Z1CP01,SUKABUMI KOTA,200
1425,1,937299,SKI-WR. ENUNG,JL. CIBENCOY NO.7 RT.2/1 MANGK,SUKABUMI,43156,SKI-Z1CP01,SUKABUMI KOTA,200
1426,1,937300,SKI-WR. PAK KEMI,PERUM GRIYA PERMATA PERMAI N0.,SUKABUMI,43152,SKI-Z1CP01,SUKABUMI KOTA,200
1427,1,937301,SKI-WR. NURJANAH,JL. JALUR MANGKALAYA,SUKABUMI,43156,SKI-Z1CP01,SUKABUMI KOTA,200
1428,1,937303,SKI-WR. PENTI,PANGKALAN SANTIANG RT.1/7 CIPA,SUKABUMI,43134,SKI-Z1CP01,SUKABUMI KOTA,200
1429,1,937304,SKI-TK. HENDRA,JL. PELABUHAN II KM. 4 DAYEUH,SUKABUMI,43134,SKI-Z1CP01,SUKABUMI KOTA,200
1430,1,937305,SKI-WR. IBU WATI,MERDEKA SENTMIANG RT.1/7 CIPAN,SUKABUMI,43134,SKI-Z1CP01,SUKABUMI KOTA,200
1431,1,937307,SKI-TK. PELITA JAYA,JL. MERDEKA SANTIANG RT.1/7 CI,SUKABUMI,43134,SKI-Z1CP01,SUKABUMI KOTA,200
1432,1,937309,SKI-TK. H. RAISA,JL. MERDEKA NO.16 RT.2/3 CIPAN,SUKABUMI,43134,SKI-Z1CP01,SUKABUMI KOTA,200
1433,1,937310,SKI-WR. PAK IIB,JL. MERDEKA TUGU JAYA RT.1/4 C,SUKABUMI,43134,SKI-Z1CP01,SUKABUMI KOTA,200
1434,1,937311,SKI-TK. TAWAKAL,JL. MERDEKA SATIONG NO.106 RT.,SUKABUMI,43134,SKI-Z1CP01,SUKABUMI KOTA,200
1435,1,937317,SKI-TK. KURNIA,"JL. MERDEKA RT.1/6 SITUGEDE, L",SUKABUMI,43134,SKI-Z1CP01,SUKABUMI KOTA,200
1436,1,937331,SKI-TK. RINA JAYA,PELABUHAN II NO.35 LEMBURSITU,SUKABUMI,43169,SKI-Z1CP01,SUKABUMI KOTA,200
1437,1,937333,SKI-TK. SEGER,JL. PEMUDA NO.26 RT.2/7 CIKOND,SUKABUMI,43143,SKI-Z1CP01,SUKABUMI KOTA,200
1438,1,937335,SKI-WR. DESI,JL. TEGAR WANGI SUKAKARYA RT.3,SUKABUMI,43135,SKI-Z1CP01,SUKABUMI KOTA,200
1439,1,937336,SKI-TK. GUMILAR,JL. PELABUHAN II RT.2/1 SITUME,SUKABUMI,43169,SKI-Z1CP01,SUKABUMI KOTA,200
1440,1,937338,SKI-TK. BELPIT,RA. KOSASIH 383 KEBONJATI RT.5,SUKABUMI,43112,SKI-Z1CP01,SUKABUMI KOTA,200
1441,1,937339,SKI-TK. BUMI JAYA,JL. CEMERLANG NO.65 RT.1/2 SUK,SUKABUMI,43133,SKI-Z1CP01,SUKABUMI KOTA,200
1442,1,937342,SKI-WR. SUHENDI,JL. PEMUDA I CIKONDANG CITAMIA,SUKABUMI,43142,SKI-Z1CP01,SUKABUMI KOTA,200
1443,1,937344,SKI-TK. LK,JL. OTISTA NO.45 RT.1/1 GN. JA,SUKABUMI,43112,SKI-Z1CP01,SUKABUMI KOTA,200
1444,1,937345,SKI-TK. ASGAR,JL. CEMERLANG NO.7 SUKAKARYA R,SUKABUMI,43133,SKI-Z1CP01,SUKABUMI KOTA,200
1445,1,937346,SKI-WR. ALFIN,JL. CEMERLANG NO.5 RT.3/10 SUK,SUKABUMI,43133,SKI-Z1CP01,SUKABUMI KOTA,200
1446,1,937428,SKI-TK. BAROKAH,"JL. PELABUHAN II KM.07 NO.360,",KAB. SUKABUMI,43169,SKI-Z1CP01,SUKABUMI KOTA,200
1447,1,937508,SKI-WR. TEH EKI,JL. SELAJAMBE NO.1 RT.9/4 CISA,SUKABUMI,43152,SKI-Z1CP01,SUKABUMI KOTA,200
1448,1,937512,SKI-WR. PAK YUDI,SELAJAMBE NO.7 RT.11/4 CISAAT,SUKABUMI,43152,SKI-Z1CP01,SUKABUMI KOTA,200
1449,1,937515,SKI-TK. RAHMAT,JL. CITAMIANG RT.9/2 KADUDAMPI,SUKABUMI,43153,SKI-Z1CP01,SUKABUMI KOTA,200
1450,1,937518,SKI-TK. H DIMYATI,KP. SELAJAMBE NO.831 RT.12/5 S,SUKABUMI,43152,SKI-Z1CP01,SUKABUMI KOTA,200
1451,1,937522,SKI-WR. PAK ASEP,JL. CIMAHI GIRANG NO.3 CITAMIA,SUKABUMI,43153,SKI-Z1CP01,SUKABUMI KOTA,200
1452,1,937523,SKI-TK. ABANG WILDAN,JL. CIMAHI GIRANG RT.19/6 KADU,SUKABUMI,43153,SKI-Z1CP01,SUKABUMI KOTA,200
1453,1,937527,SKI-TK. ABANG BAIM,KP. CISARUA RT.13/03 SUKAMANIS,SUKABUMI,43153,SKI-Z1CP01,SUKABUMI KOTA,200
1454,1,937530,SKI-WR. ANI,"JL. CISARUA RT.13/3 SUKAMANIS,",SUKABUMI,43153,SKI-Z1CP01,SUKABUMI KOTA,200
1455,1,937532,SKI-TK. IBU ESIH,KP. CIMENTENG NO.1 RT.19/4 KAD,SUKABUMI,43153,SKI-Z1CP01,SUKABUMI KOTA,200
1456,1,937552,SKI-TK. LILIS,JL. CIBOLANG NO.7 RT.7/2 CISAA,SUKABUMI,43152,SKI-Z1CP01,SUKABUMI KOTA,200
1457,1,937558,SKI-TK. PAK ADANG,KP. CILOMANG RT.3/2 KADUDAMPIT,SUKABUMI,43153,SKI-Z1CP01,SUKABUMI KOTA,200
1458,1,937561,SKI-WR. ELANG,JL. CIKIRAY KIDUL NO.7  RT.2/9,SUKABUMI,43152,SKI-Z1CP01,SUKABUMI KOTA,200
1459,1,937563,SKI-TK. KANTIN ARINA,JL. KERAMAT NO.63 KABANDUNGAN,SUKABUMI,43122,SKI-Z1CP01,SUKABUMI KOTA,200
1460,1,937566,SKI-WR. ESIH,KP. CIAUL KALER NO.76 RT.4/7 S,SUKABUMI,43116,SKI-Z1CP01,SUKABUMI KOTA,200
1461,1,937568,SKI-WR. PAK IWAN,JL. CIMAHPAR 1 NO.10 RT.1/11 S,SUKABUMI,43192,SKI-Z1CP01,SUKABUMI KOTA,200
1462,1,937572,SKI-TK. BAROKAH,JL. CIBEUREUM NO.4 RT.1/4 PASI,SUKABUMI,43192,SKI-Z1CP01,SUKABUMI KOTA,200
1463,1,937573,SKI-WR. PAK ASEP,JL. CIMAHPAR NO.36 SUKARAJUA R,SUKABUMI,43192,SKI-Z1CP01,SUKABUMI KOTA,200
1464,1,937672,SKI-TK. MALIDINA,JL. PELDA SURYANTA NO.82 RT.2/,SUKABUMI,43141,SKI-Z1CP01,SUKABUMI KOTA,200
1465,1,937673,SKI-WR. ENAN,JL. SANIN NO. 91 RT.1/6 BENTEN,SUKABUMI,43132,SKI-Z1CP01,SUKABUMI KOTA,200
1466,1,937674,SKI-TK. LIESTA,JL. LIMUS NUNGGAL NO.5 CIBEURE,SUKABUMI,43142,SKI-Z1CP01,SUKABUMI KOTA,200
1467,1,937675,SKI-TK. FAMILI JAYA,JL. LIMUS NUNGGAL 98 RT.2/7 CI,SUKABUMI,43142,SKI-Z1CP01,SUKABUMI KOTA,200
1468,1,937676,SKI-WR. IBU IIN,JL. PASIR SEJAHTERA NO.96 RT.4,SUKABUMI,43141,SKI-Z1CP01,SUKABUMI KOTA,200
1469,1,937678,SKI-TK. DIKI,"JL. PASI MULUS NO.19 RT.6/7, N",SUKABUMI,43141,SKI-Z1CP01,SUKABUMI KOTA,200
1470,1,937680,SKI-TK. AL BAROKAH,JL. PABUARAN 22 RT.5/2 NYOMPLO,SUKABUMI,43132,SKI-Z1CP01,SUKABUMI KOTA,200
1471,1,937682,SKI-WR. SANTOSA,JL. PERUM BUMI PASIR RAHAYU NO,SUKABUMI,43141,SKI-Z1CP01,SUKABUMI KOTA,200
1472,1,937683,SKI-WR. NELI,JL. SANIIN NO.55 RT.10/1 KEL B,SUKABUMI,43132,SKI-Z3CP01,"WARUNG KIARA,CITARIK,",203
1473,1,937685,SKI-WR. PANI,JL. SANIIN NO.89 RT.10/2 KEL.,SUKABUMI,43132,SKI-Z1CP01,SUKABUMI KOTA,200
1474,1,937686,SKI-WR. AGIAT,JL. SANIIN NO.99 RT.1/6 BENTEN,SUKABUMI,43132,SKI-Z1CP01,SUKABUMI KOTA,200
1475,1,937688,SKI-TK. FADIL BARKAH,"JL. NYOMPLONG NO.35 PABUARAN,",SUKABUMI,43132,SKI-Z1CP01,SUKABUMI KOTA,200
1476,1,937851,SKI-TO. CIBEBER FARMA,JL. CIBEBER RT.05/01 DS. CIKON,CIANJUR,43262,SKI-Z3CP01,"WARUNG KIARA,CITARIK,",202
1477,1,937854,SKI-TK. DENAY,KP. CUGENANG RT.03/01 CIJEDI C,CIANJUR,43212,SKI-Z3CP01,"WARUNG KIARA,CITARIK,",202
1478,1,938032,SKI-WR. ADE,"JL. BAROS NO.105 RT.2/7 BAROS,",SUKABUMI,43161,SKI-Z1CP01,SUKABUMI KOTA,200
1479,1,938034,SKI-WR. KEMBAR,JL. BAROS JUBLEG NO.1 RT. 3/5,SUKABUMI,43161,SKI-Z1CP01,SUKABUMI KOTA,200
1480,1,938037,SKI-WR. PAK MISBAH,JL. BAROS NO. 201 RT.2/6  JAYA,SUKABUMI,43161,SKI-Z1CP01,SUKABUMI KOTA,200
1481,1,938038,SKI-WR. BERKAH,JL. BAROS RT.1/7 BAROS,SUKABUMI,43161,SKI-Z1CP01,SUKABUMI KOTA,200
1482,1,938039,SKI-TK. DENI,JL. RH. MDIDI SUKARDI NO.140 R,SUKABUMI,43141,SKI-Z1CP01,SUKABUMI KOTA,200
1483,1,938041,SKI-TK. REGAS,JL. RH. DIDI SUKARDI RT.1/6 CI,SUKABUMI,43141,SKI-Z1CP01,SUKABUMI KOTA,200
1484,1,938042,SKI-WR. DADANG,KP. LEGOK RT.2/3 CIBEUREUM,SUKABUMI,43142,SKI-Z1CP01,SUKABUMI KOTA,200
1485,1,938044,SKI-WR. TEH IIN,KP. SARASA NO.1 RT.4/8 BABAKAN,SUKABUMI,43142,SKI-Z1CP01,SUKABUMI KOTA,200
1486,1,938046,SKI-WR. YANI,JL. DIDI SUKARDI NO.129 RT.4/1,SUKABUMI,43141,SKI-Z1CP01,SUKABUMI KOTA,200
1487,1,938048,SKI-WR. H. AAH,JL. LIO CIKONDANG RT.1/1 CITAM,SUKABUMI,43141,SKI-Z1CP01,SUKABUMI KOTA,200
1488,1,938050,SKI-WR. PAK ACONG,JL. KP. BARU RT.5/4 CITAMIANG,SUKABUMI,43142,SKI-Z1CP01,SUKABUMI KOTA,200
1489,1,938052,SKI-WR. PAK ADANG,JL. GARUDA NO.18 DPN. ALFA BAR,SUKABUMI,43161,SKI-Z1CP01,SUKABUMI KOTA,200
1490,1,938055,SKI-TK. BINTAN,JL. PAJAGALON NO.60 RT.1/3 NYO,SUKABUMI,43132,SKI-Z1CP01,SUKABUMI KOTA,200
1491,1,938056,SKI-TK. PANLING,JL. PAJAGALON NO.81 RT.1/3 NYO,SUKABUMI,43132,SKI-Z1CP01,SUKABUMI KOTA,200
1492,1,938058,SKI-TK. IBU ODAH,KP. CIBEUREUM NO.67 RT.6/2 CIR,SUKABUMI,43142,SKI-Z1CP01,SUKABUMI KOTA,200
1493,1,938096,SKI-TK. IBU ETI,JL. AMIRNA AJMALI NO.91 RT.4/6,SUKABUMI,43121,SKI-Z1CP01,SUKABUMI KOTA,200
1494,1,938097,SKI-TK. DADAN,JL. SRIWEDARI NO.18 RT.2/3 GN.,SUKABUMI,43121,SKI-Z1CP01,SUKABUMI KOTA,200
1495,1,938098,SKI-WR. ILHAM,JL. RA KOSASIH NO.8 RT.5/3 KEB,SUKABUMI,43162,SKI-Z1CP01,SUKABUMI KOTA,200
1496,1,938100,SKI-TK. MALABAR,JL. KRAKATAU 34 RT. 1/10 CIBEU,SUKABUMI,43142,SKI-Z1CP01,SUKABUMI KOTA,200
1497,1,938162,SKI-TK. ABAH WAHID,JL. SEJAHTERA RT.2/21 DAYEH WA,SUKABUMI,43133,SKI-Z1CP01,SUKABUMI KOTA,200
1498,1,938164,SKI-WR. ILHAM,JL. PELABUHAN II NO.21 RT.2/2,SUKABUMI,43156,SKI-Z1CP01,SUKABUMI KOTA,200
1499,1,938170,SKI-WR. ARIF,JL. PELABUHAN NO.134 KM 9 KEBO,SUKABUMI,43156,SKI-Z1CP01,SUKABUMI KOTA,200
1500,1,938173,SKI-WR. RELIS BAROKAH,JL. PELABUHAN II KM. 7 RT.1/5,SUKABUMI,43134,SKI-Z1CP01,SUKABUMI KOTA,200
1501,1,938174,SKI-WR. CITRA,JL. PELABUHAN II NO.533 SINDAN,SUKABUMI,43134,SKI-Z1CP01,SUKABUMI KOTA,200
1502,1,938177,SKI-WR. PAK DEDEN,JL. PELABUHAN II NO.1 RT.2/9 S,SUKABUMI,43116,SKI-Z1CP01,SUKABUMI KOTA,200
1503,1,938179,SKI-WR. MELATI,JL. KARTARAHARJA RT.2/2 CIKEMB,SUKABUMI,43157,SKI-Z1CP01,SUKABUMI KOTA,200
1504,1,938182,SKI-WR. IBU TITIA,JL. KERTARAHARJA RT.2/2 CIKEMB,SUKABUMI,43157,SKI-Z3CP01,"WARUNG KIARA,CITARIK,",202
1505,1,938183,SKI-WR. UJANG,JL. SEJAHTERA NO.47 JATILUHUR,SUKABUMI,43133,SKI-Z1CP01,SUKABUMI KOTA,200
1506,1,938185,SKI-WR. NISA,JL. KERTARAHARJA RT.2/2 CIKEMB,SUKABUMI,43157,SKI-Z3CP01,"WARUNG KIARA,CITARIK,",202
1507,1,938192,SKI-WR. IBU MALIA,JL. KERTARAHARJA NO.27 RT.3/7,SUKABUMI,43157,SKI-Z3CP01,"WARUNG KIARA,CITARIK,",202
1508,1,938193,SKI-TK. LEGOK,JL. KERTARAHARJA RT.3/1 CIKEMB,SUKABUMI,43157,SKI-Z2CP01,"CIKEMBAR,CIKEMBANG,CIB",201
1509,1,938194,SKI-OSHIM CELL,JL. PANGLESERAN NO. 39 SINAR R,SUKABUMI,43156,SKI-Z1CP01,SUKABUMI KOTA,200
1510,1,938195,SKI-WR. IBU ERIS,JL. PANGLESERAN NO.39 RT.01/03,SUKABUMI,43152,SKI-Z1CP01,SUKABUMI KOTA,200
1511,1,938196,SKI-TK. RJ,JL. PANGLESERAN NO.1 RT.3/1 CI,SUKABUMI,43157,SKI-Z1CP01,SUKABUMI KOTA,200
1512,1,938197,SKI-TK. HENDRA,JL. KERTARAHARJA PANGLESERAN,SUKABUMI,43157,SKI-Z1CP01,SUKABUMI KOTA,200
1513,1,938198,SKI-TK. ASEP,JL. PANGLESERAN SINAR RESMI RT,SUKABUMI,43152,SKI-Z1CP01,SUKABUMI KOTA,200
1514,1,938203,SKI-TK. DIAN,JL. KABENDUNGAN 27 RT.3/8 GN.,SUKABUMI,43123,SKI-Z1CP01,SUKABUMI KOTA,200
1515,1,938204,SKI-TK. GARASI,JL. KABENDUNGAN 133 RT. 5/6 SE,SUKABUMI,43114,SKI-Z1CP01,SUKABUMI KOTA,200
1516,1,938206,SKI-WR. KEMBAR,JL. BAROS JUBLEG RT.3/6 BAROS,SUKABUMI,43161,SKI-Z1CP01,SUKABUMI KOTA,200
1517,1,938208,SKI-TK. IBU NYAI SUMIATI,JL. PARUNG SEAH KABANDUNGAN RT,SUKABUMI,43123,SKI-Z1CP01,SUKABUMI KOTA,200
1518,1,938210,SKI-TK. DIKI,JL. NANGELA RT.1/7 BAROS,SUKABUMI,43161,SKI-Z1CP01,SUKABUMI KOTA,200
1519,1,938212,SKI-WR. PURI,JL. GARUDA RT.3/1 BAROS JUBLEG,SUKABUMI,43161,SKI-Z1CP01,SUKABUMI KOTA,200
1520,1,938223,SKI-TK. MARBON,JL. GARUDA NO.18 RT.3/11 BAROS,SUKABUMI,43161,SKI-Z1CP01,SUKABUMI KOTA,200
1521,1,938224,SKI-TK. UMI JETA,JL. DEWI SARTIKA NO. 1 SUKABUM,SUKABUMI,43121,SKI-Z1CP01,SUKABUMI KOTA,200
1522,1,938225,SKI-WR. PAK ACENG,KP. BARU RT.5/4 CITAMIANG,SUKABUMI,43141,SKI-Z1CP01,SUKABUMI KOTA,200
1523,1,938226,SKI-TK. KEMBAR CELL,JL. KABENDUNGAN SELABATU RT.2/,SUKABUMI,43113,SKI-Z1CP01,SUKABUMI KOTA,200
1524,1,938227,SKI-INTAN CELL,JL. KABANDUNGAN KARAMAT RT.4/8,SUKABUMI,43123,SKI-Z1CP01,SUKABUMI KOTA,200
1525,1,938983,SKI-AP. KAKA FARMA,JL. RS BELAKANG NO.1 SUKABUMI,SUKABUMI,43111,SKI-Z1PH01,SUKABUMI KOTA,100
1526,1,939033,SKI-AP. WARAS 2,JL. PERNIAGAAN NO. 10 GN. PARA,SUKABUMI,43111,SKI-Z1PH01,SUKABUMI KOTA,100
1527,1,939526,SKI-TK. MELATI CIBINONG,JL. PERTIGAAN ANKOLA-SUKAJADI,CIANJUR,43271,SKI-Z3CP02,"CIANJUR SELATAN, SAGAR",203
1528,1,939550,SKI-TO. ABA,JL. GARUDA NO. 2B BAROS. SUKAB,SUKABUMI,43161,SKI-Z1CP01,SUKABUMI KOTA,200
1529,1,939552,SKI-TO. RESTU,JL. BAROS KM. 5 DEPAN POM BENS,SUKABUMI,43161,SKI-Z1CP01,SUKABUMI KOTA,200
1530,1,939555,SKI-TK. AANG,JL. RY. GEKBRONG CIKAHURIPAN R,CIANJUR,43261,SKI-RXLK01,EXP LUAR KOTA CIANJUR,301
1531,1,939558,SKI-TO. YUKI FARMA,JL. SILIWANGI NO. 20 DS. SAWAH,CIANJUR,43212,SKI-Z3CP01,"WARUNG KIARA,CITARIK,",202
1532,1,939562,SKI-TO. JAYA FARMA,JL. IR H. JUANDA NO.67 SELAKOP,CIANJUR,43215,SKI-Z3CP01,"WARUNG KIARA,CITARIK,",206
1533,1,939567,SKI-TK. BENDTAR,JL. P. HIDAYATULLOH NO.60/41 D,CIANJUR,43212,SKI-Z3CP01,"WARUNG KIARA,CITARIK,",206
1534,1,939568,SKI-TK. ARAUDO SYLPY,"JL. RY. SKBMI-CIANJUR, RANCAGO",CIANJUR,43285,SKI-Z3CP01,"WARUNG KIARA,CITARIK,",202
1535,1,939749,SKI-TO. SETIA,JL. SURYAKENCANA NO.172 CIBADA,KAB. SUKABUMI,43173,SKI-Z3CP01,"WARUNG KIARA,CITARIK,",202
1536,1,940082,SKI-TK. KIOS ANTUM,PASAR PELITA BLOK D-2 GN. PARA,SUKABUMI,43111,SKI-Z1CP01,SUKABUMI KOTA,200
1537,1,940083,SKI-TK. KO AMEN,JL. STASIUN BARAT (DPN STASIUN,SUKABUMI,43111,SKI-Z1CP01,SUKABUMI KOTA,200
1538,1,940085,SKI-TK. JAENUDIN,KP. CIJAMBU RT.02 RW.01 NO.13,SUKABUMI,43152,SKI-Z1CP01,SUKABUMI KOTA,200
1539,1,940618,SKI - BDG,Jl. Soekarno Hatta No. 344,BANDUNG,,SKI-Z4,SKI Z4,300
1540,1,940619,BDG - SKI,Jl. Raya Bolang kaler RT 04/RW,Sukabumi,,SKI-Z4,SKI Z4,300
1541,1,941034,SKI-TO. MULYA FARMA,JL. RY. SUKANEGARA KM.1 RAWA S,CIANJUR,43264,SKI-Z3CP02,"CIANJUR SELATAN, SAGAR",203
1542,1,941480,SKI-AP. RABBANI,JL. DR. MUWARDI NO.133 KEL. BO,CIANJUR,43216,SKI-Z3PH01,"CIANJUR KOTA, CIBEBER,",102
1543,1,941526,BAC - SKI,Jl. Raya Bolang kaler RT 04/RW,Sukabumi,,SKI-Z4,SKI Z4,300
1544,1,941730,SKI-TK. HIOE ON MOY,JL. MANGUN SARKORO NO. 83 SOLO,CIANJUR,43214,SKI-Z3CP01,"WARUNG KIARA,CITARIK,",202
1545,1,941732,SKI-AP. WALAGRI,JL. SAFIR RAYA BLOK IV NO.9 RT,SUKABUMI,43161,SKI-Z1PH01,SUKABUMI KOTA,100
1546,1,942562,YOG - SKI,Jl. Raya Bolang kaler RT 04/RW,Sukabumi,,SKI-Z4,SKI Z4,300
1547,1,943204,SKI-TK. TARUNA,PS. PEL. RATU BLOK G NO.22 PEL,SUKABUMI,43364,SKI-Z3CP01,"WARUNG KIARA,CITARIK,",202
1548,1,943673,SKI-RSUD CIMACAN,JL. RAYA CIMACAN NO.17 CIPANAS,CIANJUR,43253,SKI-Z3PH01,"CIANJUR KOTA, CIBEBER,",102
1549,1,944012,SKI-AP. INSHA FARMA,KP. CIBENCOY RT.28/08 DESA CIS,SUKABUMI,43152,SKI-Z1PH01,SUKABUMI KOTA,100
1550,1,944649,SKI-AP. SEGER WARAS,JL. SILIWANGI NO. 147 RT.001 R,KAB. SUKABUMI,43351,SKI-Z3PH01,"CIANJUR KOTA, CIBEBER,",102
1551,1,944995,SKI-MPR B7 SKB,JL. RY. CIBOLANG DS. CIBOLANG,SUKABUMI,43152,SKI-RXPD01,EXP DALAM KOTA SUKABUM,302
1552,1,945052,SKI-TK. IBU LILIK,KP. CIBINGBIN RT.01 RW.04 SUKA,CIANJUR,43264,SKI-Z3CP01,"WARUNG KIARA,CITARIK,",202
1553,1,945160,PMS - SKI,Jl. Raya Bolang kaler RT 04/RW,Sukabumi,,SKI-Z4,SKI Z4,300
1554,1,945172,SKI-GRIYA SEHAT NURSYIFA,BANTAR PANJANG SUKAKARYA WARUD,SUKABUMI,43135,SKI-Z1PH01,SUKABUMI KOTA,100
1555,1,945274,SKI-TOSERBA NOUD,JL. RY. CIBEBER NO.6 CIANJUR,CIANJUR,43262,SKI-Z3CP01,"WARUNG KIARA,CITARIK,",202
1556,1,945278,SKI-MPR B7 SKB,JL. RY. CIBOLANG DS. CIBOLANG,SUKABUMI,43152,SKI-Z1CP01,SUKABUMI KOTA,200
1557,1,945436,SKI-TEAM PROMOSI PT. BINTANG TOE,JL. RY. CIBOLANG DS. CIBOLANG,KAB. SUKABUMI,43152,SKI-Z1CP01,SUKABUMI KOTA,200
1558,1,945600,SKI-TOSERBA HEMAT,JL. ARIAWIRATANUDATAR NO.21 RT,CIANJUR,43215,SKI-Z3CP01,"WARUNG KIARA,CITARIK,",202
1559,1,946224,SKI-TO. PALASARI,JL. KOTA BUNGA NO.86 PALASARI,CIANJUR,43253,SKI-Z3CP01,"WARUNG KIARA,CITARIK,",202
1560,1,946227,SKI-TO. ARWINDA,JL. ARYAWIRATA NUDAR NO.20 RT.,CIANJUR,43281,SKI-Z3CP01,"WARUNG KIARA,CITARIK,",301
1561,1,946228,SKI-TK. AI,JL. MANGKALAYA KEL.CIBATU RT.4,SUKABUMI,43152,SKI-Z1CP01,SUKABUMI KOTA,200
1562,1,946237,SKI-TK. IWA,JL. MANGKALAYA CIBATU CISAAT R,SUKABUMI,43152,SKI-Z1CP01,SUKABUMI KOTA,200
1563,1,946239,SKI-TK. MAMAN,JL. ALUN ALUN CISAAT RT.2/5 SU,SUKABUMI,43152,SKI-Z1CP01,SUKABUMI KOTA,200
1564,1,946242,SKI-TK. ZAINAL,JL. KADUDAMPIT NAGRAK RT.1/3 C,SUKABUMI,43152,SKI-Z1CP01,SUKABUMI KOTA,200
1565,1,946243,SKI-TK. LIA,JL. MANGKALAYA CIBATU RT.5/3 C,SUKABUMI,43152,SKI-Z1CP01,SUKABUMI KOTA,200
1566,1,946263,SKI-TK. ENUH,JL. MANGKALAYA CIBATU RT.10/04,SUKABUMI,43152,SKI-Z1CP01,SUKABUMI KOTA,200
1567,1,946732,SKI-AP. SUMBER SEHAT,JL. PERNIAGAAN NO 14 RT.003 RW,SUKABUMI,43113,SKI-Z1PH01,SUKABUMI KOTA,100
1568,1,947400,SKI-TK. KAPUAS,JL. KAUM KALER RT.13/06 GN. PU,SUKABUMI,43123,SKI-Z1CP01,SUKABUMI KOTA,200
1569,1,947402,SKI-TK. TANGGUH,JL. CIBARAJA DPN PS. IKAN SELA,SUKABUMI,43152,SKI-Z1CP01,SUKABUMI KOTA,200
1570,1,947416,SKI-TK. SARKAWI,PERUM MANGKALAYA RT.2 RW.3 GN.,SUKABUMI,43156,SKI-Z1CP01,SUKABUMI KOTA,200
1571,1,947417,SKI-TK. JAJANG,JL. CIBARAJA PS. IKAN KEL. SEL,SUKABUMI,43152,SKI-Z1CP01,SUKABUMI KOTA,200
1572,1,947658,SKI - DC2,Jl. Berbek Industri VII No. 8,SIDOARJO,61256,SKI-Z4,SKI Z4,300
1573,1,947767,SKI - BAC,Jl Lampeuneurut - Pekan Biluy,,,SKI-Z4,SKI Z4,300
1574,1,948021,SKI-TK. EKA JAYA,"JL. RY SIPON NO. 290 CIANJUR ,",CIANJUR,43282,SKI-Z3CP01,"WARUNG KIARA,CITARIK,",202
1575,1,948172,SKI-DANI GUMILAR,JL. RY. SUKABUMI CIANJUR KM.8,SUKABUMI,43192,SKI-Z1PH01,SUKABUMI KOTA,302
1576,1,22502,DC2 - SKI,Jl. Raya Bolang kaler RT 04/RW,Sukabumi,,SKI-Z4,SKI Z4,300
1577,1,948779,SKI-TK. HENDRIK,JL. RY. CIANJUR BANDUNG NO.103,CIANJUR,43281,SKI-Z3CP01,"WARUNG KIARA,CITARIK,",202
1578,1,949174,SKI-TK. ACEP,JL. CIBARAJA PS. IKAN RT.37/08,SUKABUMI,43132,SKI-Z1CP01,SUKABUMI KOTA,200
1579,1,949317,SKI-TK. SUMBER REJEKI,JL. RY. SILIWANGI NO. 286 DPN.,SUKABUMI,43359,SKI-Z2CP01,"CIKEMBAR,CIKEMBANG,CIB",201
1580,1,949318,SKI-TK. SOHOR,JL. CIBARAJA PS. IKAN RT.03/01,SUKABUMI,43152,SKI-Z1CP01,SUKABUMI KOTA,200
1581,1,949319,SKI-TK. AA-KASUR,JL. CIMAHI CIBARAJA RT.01/01 K,SUKABUMI,43152,SKI-Z1CP01,SUKABUMI KOTA,200
1582,1,949443,SKI-TO. CIKUKULU,JL. ABDL. BIN NUH RT.03 RW.07,CIANJUR,43215,SKI-Z3CP01,"WARUNG KIARA,CITARIK,",202
1583,1,949479,SKI-TK. ELIS,JL. RY. CISAAT CIGAYUNG NO.68,SUKABUMI,43152,SKI-Z1CP01,SUKABUMI KOTA,200
1584,1,949481,SKI-KANTIN SMA 3,JL. RY. KOSASIH CIBEUREUM RT.1,SUKABUMI,43165,SKI-Z1CP01,SUKABUMI KOTA,0
1585,1,949484,SKI-KANTIN SMK MUHAMMADIYAH,"JL. SYAMSUDIN RT.2/3 CISARUA,",SUKABUMI,43115,SKI-Z1CP01,SUKABUMI KOTA,0
1586,1,949486,SKI-KANTIN SMA 4 SUKABUMI,JL. IR. H. JUANDA NO. 8 CIKOLE,SUKABUMI,43113,SKI-Z1CP01,SUKABUMI KOTA,200
1587,1,949488,SKI-KANTIN SMK 1 SUKABUMI,JL. KABANDUNGAN NO.90 KEC. SUK,SUKABUMI,43114,SKI-Z1CP01,SUKABUMI KOTA,200
1588,1,949489,SKI-KANTIN SMK 3 SUKABUMI,JL. KABANDUNGAN NO.86 KEC. SUK,SUKABUMI,43114,SKI-Z1CP01,SUKABUMI KOTA,200
1589,1,949490,SKI-RM. TOBING MANDIRI,JL. CIBOLANG KALER RT.1/1 CISA,SUKABUMI,43152,SKI-Z1CP01,SUKABUMI KOTA,0
1590,1,949776,SKI-AP. GEMA MEDICAL CENTER,JL. BHAYANGKARA NO. 130 RT. 00,SUKABUMI,43121,SKI-Z1PH01,SUKABUMI KOTA,100
1591,1,949848,SKI-RSDH. CIANJUR,JL. PRAMUKA RT. 003 RW.002 SUK,CIANJUR,43281,SKI-Z3PH01,"CIANJUR KOTA, CIBEBER,",102
1592,1,949944,SKI-TEAM PROMOSI KSP,JL. RY. CIBOLANG RT.04 RW.02 N,SUKABUMI,43152,SKI-Z1CP01,SUKABUMI KOTA,200
1593,1,950063,SKI-TK. NANANG,JL. CIBARAJA PS. IKAN RT.37/08,SUKABUMI,43152,SKI-Z1CP01,SUKABUMI KOTA,301
1594,1,950429,SKI-RS. KARTIKA MEDICAL CENTER,JL. JEND. A. YANI NO. 18 A KEL,SUKABUMI,43131,SKI-Z1PH01,SUKABUMI KOTA,100
1595,1,950442,SKI-SC. BARCA FUTSAL,JL. VETERAN CISAAT NO.43 A RT.,SUKABUMI,43152,SKI-Z1CP01,SUKABUMI KOTA,200
1596,1,950444,SKI-RM. PADASUKA,JL. RY. SUKABUMI KAMPUNG BAROS,SUKABUMI,43191,SKI-Z3CP01,"WARUNG KIARA,CITARIK,",202
1597,1,950449,SKI-TK. SUKAHATI / ELLIS,JL. CIAYUNG DPN MASJID BAITURR,SUKABUMI,43152,SKI-Z1CP01,SUKABUMI KOTA,200
1598,1,950453,SKI-KANTIN SMKN 1 SUKABUMI,JL. KABANDUNGAN NO.10 KARANGTE,SUKABUMI,43121,SKI-Z1CP01,SUKABUMI KOTA,300
1599,1,950456,SKI-KANTIN SMKN 3 SUKABUMI,JL. KABANDUNGAN NO.86 KEL. KAR,SUKABUMI,43121,SKI-Z1CP01,SUKABUMI KOTA,301
1600,1,950460,SKI-KANTIN SMAN 4 SUKABUMI,JL. R. JUANDA NO. 8 SUKABUMI,SUKABUMI,43113,SKI-Z1CP01,SUKABUMI KOTA,200
1601,1,950630,SKI-TK. BAKRI,JL. CIBATU 01/04 CISAAT,SUKABUMI,43152,SKI-Z1CP01,SUKABUMI KOTA,200
1602,1,950631,SKI-TK. RINA,JL CIBATU 01/04 CISAAT,SUKABUMI,43152,SKI-Z1CP01,SUKABUMI KOTA,200
1603,1,950633,SKI-TK. ANIN,JL. CIBATU 02/04 CISAAT,SUKABUMI,43152,SKI-Z1CP01,SUKABUMI KOTA,200
1604,1,950635,SKI-TK. APONG,JL. CIBATU 02/04 CISAAT,SUKABUMI,43152,SKI-Z1CP01,SUKABUMI KOTA,200
1605,1,950636,SKI-TK. SAPUTRA,JL. CIBATU 01/04 CISAAT,SUKABUMI,43152,SKI-Z1CP01,SUKABUMI KOTA,200
1606,1,950638,SKI-TK. DAMAN,JL. CIBATU 01/01 CISAAT,SUKABUMI,43152,SKI-Z1CP01,SUKABUMI KOTA,200
1607,1,950639,SKI-TK. DIDAN,JL. CIBATU 01/01 CISAAT,SUKABUMI,43152,SKI-Z1CP01,SUKABUMI KOTA,200
1608,1,950643,SKI-TK. HJ. IDA,JL. CIBATU 01/01 CISAAT,SUKABUMI,43152,SKI-Z1CP01,SUKABUMI KOTA,0
1609,1,950646,SKI-TK. AMANAH,JL. CIBATU 04/05 CISAAT,SUKABUMI,43152,SKI-Z1CP01,SUKABUMI KOTA,0
1610,1,950647,SKI-TK. LIA,JL. CIBATU 04/05 CISAAT,SUKABUMI,43152,SKI-Z1CP01,SUKABUMI KOTA,0
1611,1,950648,SKI-TK. SANTI,JL. CIBATU 02/01 CISAAT,SUKABUMI,43152,SKI-Z1CP01,SUKABUMI KOTA,0
1612,1,950649,SKI-TK. ALIF,JL. CIBATU 02/01 CISAAT,SUKABUMI,43152,SKI-Z1CP01,SUKABUMI KOTA,0
1613,1,950650,SKI-TK. YASRI,JL CIBATU 02/02 CISAAT,SUKABUMI,43152,SKI-Z1CP01,SUKABUMI KOTA,200
1614,1,950654,SKI-TK. LILIS,JL. CIBATU 04/01 CISAAT,SUKABUMI,43152,SKI-Z1CP01,SUKABUMI KOTA,0
1615,1,950655,SKI-TK. H. USEP,JL. CIBATU 01/04 CISAAT,SUKABUMI,43152,SKI-Z1CP01,SUKABUMI KOTA,0
1616,1,950657,SKI-TK. ANAY,JL. CIBATU 01/02 CISAAT,SUKABUMI,43152,SKI-Z1CP01,SUKABUMI KOTA,0
1617,1,950689,SKI-SC. LIVERPOOL FUTSAL,JL. MESJID 1/2 - KOMPLEK LAP M,SUKABUMI,43111,SKI-Z1CP01,SUKABUMI KOTA,200
1618,1,950691,SKI-SC. 33 FUTSAL,"PELDA SURYANTA NO. 3 , SUKABUM",SUKABUMI,43133,SKI-Z1CP01,SUKABUMI KOTA,200
1619,1,950706,SKI-SC. DOUBLE D FUTSAL,JL. BALAI PURWASARI RT.03 RW.0,SUKABUMI,43359,SKI-Z3CP01,"WARUNG KIARA,CITARIK,",202
1620,1,950831,SKI-SC. CS FUTSAL,JL. SUKABUMI CIANJUR KM. 13 CI,SUKABUMI,43191,SKI-Z3CP01,"WARUNG KIARA,CITARIK,",202
1621,1,950957,SKI-TK. SELAAWI,JL. SELAJAMBE RT.05/02 NO.25 C,SUKABUMI,43152,SKI-Z1CP01,SUKABUMI KOTA,200
1622,1,951701,SKI-AP. HARAPAN HIDUP,KP. CIBODAS RT.03/04 NO.3 DS.,SUKABUMI,43157,SKI-Z2PH01,"PALABUHAN RATU, SURADE",101
1623,1,951709,SKI-KLINIK AS SHOFAA,JL. SILIWANGI NO.86 B WARUNGKI,SUKABUMI,43362,SKI-Z3PH01,"CIANJUR KOTA, CIBEBER,",102
1624,1,951714,SKI-TK. SEJAHTERA,JL. RY. CITEPUS RT.03/RW.04 PL,SUKABUMI,43365,SKI-Z3CP01,"WARUNG KIARA,CITARIK,",202
1625,1,951718,SKI-WR. IROH,JL. CEMERLANG CIKAREO RT.003/0,SUKABUMI,43135,SKI-Z1CP01,SUKABUMI KOTA,200
1626,1,951804,SKI-TO. GELORA MEDIKA,"KP. SIPON HAURWANGI, CIANJUR",CIANJUR,43282,SKI-Z3CP02,"CIANJUR SELATAN, SAGAR",203
1627,1,952227,SKI - BD2,Jl. Cimuncang No.30.32,Bandung,,SKI-Z3CP02,"CIANJUR SELATAN, SAGAR",204
1628,1,952242,SKI - CRB,Jl. Nyi Gede Cangkring blok Si,Cirebon,,SKI-Z4,SKI Z4,300
1629,1,952267,SKI - PWK,"Jl. Soeparjo Roestam,Km.4,1 Rt",,53181,SKI-Z4,SKI Z4,300
1630,1,952268,SKI - TGL,Jl. Teuku Umar No. 9,TEGAL,,SKI-Z4,SKI Z4,300
1631,1,952269,SKI - TGR,Jl Pajajaran Kel. Gandasari,TANGERANG,,SKI-Z4,SKI Z4,300
1632,1,952432,SLO - SKI,Jl. Raya Bolang kaler RT 04/RW,Sukabumi,,SKI-Z4,SKI Z4,300
1633,1,952437,SKI - SLO,"Jl. Amarta Raya no. 8, Ngabeya",SOLO,,SKI-Z4,SKI Z4,300
1634,1,952441,CRB - SKI,Jl. Raya Bolang kaler RT 04/RW,Sukabumi,Indonesi,SKI-Z4,SKI Z4,300
1635,1,952666,SKI-KANTIN IBU ADE KULSUM,JL. SALABINTANA NO.21 RIZZY AZ,SUKABUMI,43151,SKI-Z1CP01,SUKABUMI KOTA,200
1636,1,952671,SKI-MM. RIZZY AZZAHRA,JL. SALABINTANA NO.21 RIZZY AZ,SUKABUMI,43151,SKI-Z1CP01,SUKABUMI KOTA,200
1637,1,952693,SKI-KEDAI RESIK IBU TEJA,JL. SALABINTANA NO.21 RIZZY AZ,SUKABUMI,43151,SKI-Z1CP01,SUKABUMI KOTA,200
1638,1,952741,SKI-TK. NURDIN,"KP. LOJI RT.05/001 BATULAWANG,",CIANJUR,43253,SKI-Z3CP01,"WARUNG KIARA,CITARIK,",202
1639,1,952742,SKI-TK. KARYA GEMILANG,JL. CIBEBER NO.4 RT.2/2 CIPETI,CIANJUR,43262,SKI-Z3CP01,"WARUNG KIARA,CITARIK,",202
1640,1,952799,SKI-MM. BOBBY,JL. BHAYANGKARA NO.222A DPN. G,SUKABUMI,43114,SKI-Z1CP01,SUKABUMI KOTA,200
1641,1,952803,SKI-TK. REFINA,JL. CILAKU WR.KONDANG CILAKU E,CIANJUR,43285,SKI-Z3CP01,"WARUNG KIARA,CITARIK,",202
1642,1,952851,SKI-TO. SUKARAJA,JL. RY. SUKARAJA NO.281 DPN. S,SUKABUMI,43192,SKI-Z1CP01,SUKABUMI KOTA,200
1643,1,953209,SKI-TK. SJ GROSS,JL. PABUARAN NO.74 DAYEUH LUHU,SUKABUMI,43111,SKI-Z1CP01,SUKABUMI KOTA,200
1644,1,953220,TGR - SKI,Jl. Raya Bolang kaler RT 04/RW,Sukabumi,,SKI-Z4,SKI Z4,300
1645,1,953232,SKI-PT. DUTA INTIDAYA,JL. A. YANI NO.125-127 LT. DSR,SUKABUMI,43111,SKI-Z1CP01,SUKABUMI KOTA,200
